,text,expected_label,actual_label,result
0,TITLE: Endless Ledge Skip Campaign for Alts POST: Reading everyone's comments has made me change my opinion on having an adventure mode like thing in PoE.,nothing,"rephrased question: examine the given passage and identify the type of logical fallacy present by referring to the definitions of common fallacies.

**segment:** title: endless ledge skip campaign for alts post: after reading all the comments, i have changed my viewpoint on including a mode similar to adventure in poe.

#### response template:
the passage exhibits the ad populum fallacy. this fallacy arises when an argument is considered true or valid due to widespread belief, without taking into account the actual strength of the claim.",False
1,I keep seeing if an adventure mode needs to exist then why not just start a char at 68.,slippery slope,"the segment demonstrates the fallacy of hasty generalization. this fallacy occurs when a conclusion is drawn based on a small sample size or limited information, in this case assuming that starting a character at level 68 would be an appropriate solution for an adventure mode without considering other factors or alternatives.",False
2,then a couple months after that we'll see post about how people want to start at 90 just so they can kill bosses.,slippery slope,"the segment contains the fallacy of straw man. this fallacy occurs when a person misrepresents another's argument to make it easier to attack, as if they are arguing against something weaker or different than what was actually argued. in this case, the text implies that people are suggesting starting at level 90 just for killing bosses, while the actual argument could be about improving game experience or other reasons.",False
3,"Then a few months later we'll see people asking for a""creative"" mode so they can have access to all items in the game so they don't have to farm, and i dont think that sets a good example as a community for a game that we all love.",slippery slope,"the segment exhibits the fallacy of straw man. this fallacy is present because it misrepresents the opponent's argument by claiming that people are asking for a ""creative"" mode just to have access to all items and avoid farming, rather than considering other possible reasons behind this request.",False
4,"Two of my best friends are really introverted, shy people, and they both have cats.",nothing,"the provided segment demonstrates the fallacy of hasty generalization. this error is committed when a conclusion is drawn from an insufficient or unrepresentative sample, leading to a broad and potentially inaccurate claim. in this case, the statement suggests that because two introverted, shy individuals own cats, it might be assumed that most or all introverted, shy people have cats, which is not necessarily true based on such a small sample size.",False
5,That leads to me believe that most cat lovers are really shy.,hasty generalization,"the segment contains the fallacy of hasty generalization. this fallacy occurs when a conclusion is drawn based on insufficient or limited evidence, leading to an oversimplified view of a situation. in this case, the statement makes a sweeping generalization about cat lovers being shy, without considering the vast range of personality types and behaviors among individuals who love cats.",True
6,TITLE: There is a difference between a'smurf' and an'alt'.,nothing,"unfortunately, there is no provided text for me to analyze and identify a logical error or fallacy. please provide the text you would like me to examine, and i will be happy to help you identify and explain any potential fallacies present in it.",False
7,Please learn it and stop using them interchangeably.,nothing,"the provided text contains the fallacy of ad populum. this fallacy arises when an argument is considered valid or true merely due to the number of people who believe it, without taking into account the actual strengths of the claim. in this case, the statement ""you should always follow the crowd; they know what's best"" suggests that the majority's opinion automatically equates to truth or wisdom, which isn't necessarily the case.",False
8,POST:,nothing,"rephrased question:
in light of the given passage, which kind of logical mistake corresponds to the list of possible errors in reasoning?

passage: post

response template:
the passage exhibits the [fallacy name] fallacy. this fallacy arises when [a concise description of the identified fallacy's features or how it distorts logic].",False
9,"Someone once told me they have an""alt"" cause their main account was too high of rank to play with their friends.",false analogy,"the given text segment does not exhibit any specific logical fallacies. however, it can be considered an example of an anecdotal evidence, where a personal experience is presented as a general rule or fact without proper justification.",False
10,It's exactly the same as smurfing.,false analogy,"the segment contains the fallacy of false analogy. this fallacy occurs when a weak or misleading comparison is made between two things, suggesting that they are similar in nature or effect when they are not. in this case, the statement implies that whatever is being compared to smurfing has the same characteristics or implications, even though it may not necessarily be true.",True
11,TITLE: Discussion Thread (Part 3): 2020 Presidential Race Democratic Debates - Post Debate | Night 2 POST:,nothing,"in order to provide a rephrased question and response template, we first need an example argument and a list of possible fallacies. once we have that information, we can identify the specific fallacy and demonstrate how it is shown in the segment.

example argument:
""all politicians are corrupt. politician a is a politician, so politician a must be corrupt.""

list of possible fallacies:
1. ad hominem
2. appeal to authority
3. straw man
4. false dichotomy
5. circular reasoning
6. slippery slope
7. red herring
8. hasty generalization
9. non sequitur
10. post hoc ergo propter hoc

rephrased question:
in the given argument, which fallacy is being committed based on the list and explanations of possible fallacies? please identify the specific fallacy and briefly describe how it is demonstrated in the segment.

response template:
the argument contains the fallacy of [fallacy name]. this fallacy occurs when [short explanation of the identified fallacy].",False
12,Joe Biden will lose to Trump if he is the nominee.,guilt by association,"rephrased question:
considering the mentioned types of logical errors, which error is present in the given text? please pinpoint and explain the error that can be detected in the following assertion: ""joe biden will lose to trump if he is the nominee.""

#### response template:
the statement involves the fallacy of [fallacy name]. this fallacy takes place when [brief explanation of the identified fallacy].",False
13,The Democratic party clearly has not learned the right lesson from Hillary Clinton's miserable failure.,guilt by association,"the argument segment implies that the democratic party should have drawn a specific, correct conclusion based on hillary clinton's loss in the 2016 presidential election. however, the fallacy present in this statement is an ad hominem fallacy.

ad hominem fallacy: this is a logical fallacy where instead of addressing the argument or point being made, one attacks the person making it or their character. in this case, the argument focuses on hillary clinton's ""miserable failure"" rather than discussing the actual lesson that should have been learned from her campaign or election results.",False
14,NOBODY WANTS ESTABLISHMENT POLITICIANS ANYMORE.,causal oversimplification,"the segment presents the fallacy of hasty generalization. this fallacy arises when a conclusion is drawn from insufficient or unrepresentative evidence, as in this case where the statement assumes that ""nobody"" wants establishment politicians without providing any supporting data or context to back up the claim.",False
15,NOBODY LIKES THE STATUS QUO.,causal oversimplification,"the segment contains the fallacy of hasty generalization. this fallacy occurs when a conclusion is drawn based on a small sample size or anecdotal evidence without considering the larger context or the possibility of exceptions to the generalization. in this case, the statement ""nobody likes the status quo"" assumes that everyone dislikes the status quo, even though it might not be true for everyone.",False
16,Like Jesus Christ you think they would learn.,nothing,"the provided text does not include any content. please provide a text or statement for me to analyze and identify the logical fallacy present in it, along with an explanation for the classification.",False
17,POST:,nothing,"please provide the segment to be analyzed in order for me to identify and explain the fallacy being used. without the segment, i cannot give you an accurate analysis or response.",False
18,The status quo in America is that its the best its ever been.,circular reasoning,"the provided segment demonstrates the presence of the ""circular reasoning"" fallacy. this fallacy takes place when an argument is based on the assumption it sets out to prove, without providing any additional supporting evidence. in this case, the argument that ""the status quo in america is that it's the best it's ever been"" assumes its own conclusion, as the statement does not provide any evidence or reasoning for why it is considered to be the best it has ever been.",True
19,We live in one of the best societies in the best times that humans have ever experienced.,circular reasoning,"the given segment displays the presence of the fallacy of appeal to tradition. this fallacy occurs when an argument is made based on the assumption that something is better or more valid because it has been done in a certain way for a long time, ignoring the possibility of change or improvement.",False
20,"America is the best place to live, because it's better than any other country.",circular reasoning,"the statement exhibits the fallacy of false dichotomy. this fallacy is present because it implies that there are only two options for living conditions: america, which is considered the best, and all other countries, which are assumed to be worse. in reality, the quality of life can vary greatly within both america and other countries, and there may be aspects where some countries are better than america in certain respects.",False
21,Let us move now to the future.,appeal to fear,"rephrased question:
could you please identify the specific logical fallacy present in the following statement: ""let us move now to the future.""?

segment: let us move now to the future.

response template:
the segment contains the fallacy of appeal to tradition. this fallacy occurs when an argument is presented as being better or more valid simply because it is traditional, rather than based on logical reasoning or evidence supporting its validity. in this case, the mention of ""the future"" implies a reliance on tradition and established ways of doing things, without providing any logical rationale for choosing these paths over alternative options.",False
22,"It is not enough to stand on this record because we are dealing with the most ruthless, fanatical...",appeal to fear,"the argument in question contains the fallacy of ad hominem. this fallacy arises when a person is attacked or criticized instead of their argument, which is what happens in this case with the mention of being ""ruthless"" and ""fanatical.""",False
23,leaders that the world has ever seen.,appeal to fear,"in this context, the most likely fallacy being employed is causal oversimplification. this fallacy occurs when a single cause is attributed to an outcome that may have multiple causes, ignoring or overlooking other potential factors contributing to the situation. the statement ""the world has seen no leaders like these"" implies that there is only one reason for the exceptional nature of these leaders, without considering other possible factors or explanations.",False
24,"That is why I say that in this period of the sixties, America must move forward in every area.",causal oversimplification,"the segment demonstrates the presence of a hasty generalization. this fallacy occurs when a conclusion is drawn based on insufficient evidence or data, and it implies that a specific time period (the sixties) can be used to justify broad statements about america's progress without considering other factors or periods.",False
25,Delores is a big supporter for equal pay for equal work.,guilt by association,"the argument does not contain a logical fallacy, as it is simply stating a position or opinion held by delores. it doesn't involve an incorrect or invalid reasoning that would qualify as a logical fallacy.",False
26,This is the same policy that all those extreme feminist groups support.,guilt by association,"in the given segment, which logical error can be identified from the list and explanation of common fallacies in arguments?

segment: ""this is the same policy that all those extreme feminist groups support.""

response template: the segment exhibits the fallacy of appeal to adversary. this fallacy takes place when an argument is presented by linking it with a group or individual who is already viewed negatively, such as ""extreme feminist groups,"" rather than evaluating the policy based on its own merits.",False
27,Extremists like Delores should not be taken seriously -- at least politically.,guilt by association,"the segment displays the fallacy of ad hominem. this type of fallacy involves attacking the individual presenting the argument, instead of focusing on the merits of the argument itself. in this case, the statement targets delores' extremism as a reason to dismiss her political opinions without considering the validity of her arguments.",False
28,"""Four out of five dentists recommend Happy Glossy toothpaste.",appeal to (false) authority,"the provided segment exhibits the logical fallacy known as appeal to authority. this fallacy arises when an argument is deemed valid or correct merely because it has been endorsed by an expert or authority figure, without taking into account other crucial factors or evidence. in this instance, the claim that four out of five dentists recommend happy glossy toothpaste is used to assert its superiority, disregarding other relevant aspects such as the product's quality, safety, and actual efficacy.",False
29,"Therefore, it must be great.""",appeal to (false) authority,"rephrased question:
in the provided statement, which logical fallacy can be identified based on the list of fallacies provided?

**statement:** ""therefore, it must be great.""

response template:
the statement demonstrates an instance of the hasty generalization fallacy. this fallacy arises when a conclusion is drawn from insufficient evidence or a small sample size, without considering the broader context or potential counterexamples. in this case, the speaker jumps to the conclusion that something is ""great"" without providing adequate information or justification for their assertion.",False
30,"TITLE: Gatineau police officer tests positive, but masks still not mandatory at checkpoints POST: Guess what?",nothing,"in the given segment, it appears that an informal logical fallacy known as ""hasty generalization"" may be employed. this fallacy occurs when a conclusion is drawn from insufficient evidence or an overgeneralized assumption is made based on limited data.

the context of the segment implies that the presence of one positive case in gatineau might suggest that masks are not necessary at checkpoints, despite evidence suggesting their effectiveness. however, this is a hasty generalization because drawing such a conclusion from one instance does not provide enough information to make an accurate assessment about the overall situation or the efficacy of masks at checkpoints.",False
31,police need to interact with people at close quarters.,nothing,"rephrased question:
in light of the provided passage, which fallacy can be recognized based on the list of possible fallacies?

segment: police need to interact with people at close quarters.

response template:
the passage illustrates [fallacy name], which occurs when [brief description of the identified fallacy]. in this instance, the passage belongs to the category of [fallacy type] because it includes [a concise explanation of how the fallacy is present in the passage].",False
32,they often need to touch or grapple.,nothing,the provided segment does not contain enough information for me to identify a specific logical fallacy. please provide more context or a complete statement for me to analyze and determine which fallacy is present.,False
33,The masks do little.,nothing,"the statement ""the masks do little"" demonstrates the fallacy of causal oversimplification. this type of logical fallacy occurs when a single cause is assigned to an outcome, disregarding other contributing factors. in this instance, the effectiveness of masks is reduced to a singular factor, ignoring aspects such as proper usage, fit, and type of mask that could influence their efficacy.",False
34,Cool it.,nothing,"rephrased question:
in the given passage, can you identify which type of logical fallacy is being committed? please consider each fallacy listed and provide an appropriate response.

passage: cool it.

response template:
the passage contains the fallacy of [fallacy name]. this fallacy occurs when [short explanation of the identified fallacy].",False
35,Once they wear masks your anxiety will force you to demand the next step.,slippery slope,"the segment displays the presence of the ad hominem fallacy. this fallacy occurs when a person is attacked or criticized based on their personal traits, rather than addressing the actual argument they are making. in this case, the segment assumes that wearing masks will cause anxiety and force someone to demand the next step, instead of addressing the merits of the next step itself.",False
36,biohazard suits?,slippery slope,"the fallacy present in this segment is a false cause, also known as post hoc ergo propter hoc. this fallacy occurs when someone assumes that because one event preceded another, the first event must have caused the second event to occur. in this case, the argument assumes that since biohazard suits are only used in specific situations (working with dangerous pathogens), they are not necessary for daily wear. however, this does not necessarily mean that the suit's design or usefulness is limited to those specific situations. the suit could still be beneficial or protective in other contexts, even if it is not currently used for them.",False
37,get real.,slippery slope,the segment does not provide enough information or context to identify a specific logical fallacy. please provide a more detailed statement for analysis.,False
38,The last Democrat winner of the New Hampshire primary won the general election.,false causality,"the given segment exhibits the fallacy of post hoc ergo propter hoc. this fallacy takes place when a correlation between two events is inferred as causation, without any supporting evidence or logical reasoning. in this case, the statement assumes that because a democrat won the new hampshire primary also won the general election, the former must have caused the latter. however, there could be many other factors influencing the outcome of the general election.",False
39,"This year, the winner of the New Hampshire primary will win the general election.",false causality,"the given statement does not demonstrate the presence of a logical fallacy, as it is simply a prediction or claim and not an argument with premises and conclusions. however, if we consider the statement as an argument, it could be analyzed as follows:

the argument: this year, the winner of the new hampshire primary will win the general election.

this argument can be broken down into two parts:
1. premise: the winner of the new hampshire primary is a strong indicator of who will win the general election.
2. conclusion: therefore, this year's new hampshire primary winner will win the general election.

the fallacy present in this argument is ""hasty generalization."" this fallacy occurs when a conclusion is drawn from a limited number of cases or examples, without considering that there may be exceptions to the general rule. in this case, the argument assumes that because the new hampshire primary winner has been a strong indicator of the general election winner in the past, it will be the same for this year as well, without considering other factors that could influence the outcome.",False
40,Men score better on math than women do.,fallacy of division,"the fallacy present in this segment is ""hasty generalization"". this is because the statement ""men score better on math than women do"" generalizes the performance of men and women as a whole, without considering individual differences or factors that could influence test scores such as education, culture, or personal experiences.",False
41,Jerry is a man.,fallacy of division,"the provided segment, ""jerry is a man,"" does not contain any logical fallacies. it simply states a fact about jerry's gender.",False
42,"Therefore, Jerry is better at math than Sylvia, who is a woman.",fallacy of division,"the passage contains the fallacy of appeal to stereotype. this type of logical flaw occurs when an argument relies on a generalized stereotype instead of considering the individual or situation objectively. in this instance, the segment assumes that sylvia's math skills are inferior because she is a woman, rather than evaluating her abilities independently.",False
43,TITLE: Sign petition for Persona 5 pc and switch ports POST:,nothing,the segment provided does not contain a specific statement or argument that can be analyzed for fallacies. please provide a sentence or argument from the post for analysis.,False
44,So much important stuff in the world that needs political activism.,appeal to worse problems,"the segment appears to be employing a false dilemma (or either-or) fallacy. this type of error occurs when only two options are presented as if they are the only possible choices, while in reality there may be additional alternatives or nuances to consider. in this case, the statement implies that there is no other option than engaging in political activism for important issues, whereas there could be various other ways to contribute or address these matters.",False
45,Makes a petition to portbeg P5 onto PC and Switch.,appeal to worse problems,"the given segment does not provide enough information or context for an argument to identify any fallacies based on definitions and lists. it appears to be a request or suggestion rather than an argument, and therefore, it cannot be evaluated for logical fallacies at this time. please provide more context or information for further analysis.",False
46,Carbon dioxide hurts nobody' s health.,false analogy,"rephrased question:
in light of the definition of an argument and the list of possible logical fallacies, please determine which specific fallacy can be detected in the following statement: ""carbon dioxide does not affect anyone's health.""

segment: carbon dioxide does not affect anyone's health.

response template:
the segment embodies the fallacy of [fallacy name]. this fallacy arises when [brief explanation of the identified fallacy].

**answer:**

the segment embodies the fallacy of appeal to tradition. this fallacy materializes when an argument posits that something is superior due to its tradition, without presenting proof for its relevance or efficacy in the current situation. in this instance, the statement ""carbon dioxide does not affect anyone's health"" suggests that carbon dioxide is harmless as it has always been present in the environment, without considering the potential repercussions of elevated levels of co2 on human health and the planet.",False
47,It' s good for plants.,false analogy,"rephrased question:
given the different types of logical fallacies and their meanings, identify which fallacy can be found in the statement: ""it's good for plants.""

segment: it's good for plants.

response template:
the statement exhibits the fallacy of appeal to nature. this type of fallacy is committed when something is deemed beneficial or positive solely because it is considered 'natural', without considering other factors or possible adverse effects. in this case, the assertion that something is advantageous for plants relies only on its natural association, disregarding any potential negative aspects or alternative assessments of the subject under consideration.",False
48,Climate change need not endanger anyone.,causal oversimplification,"the segment contains the fallacy of appeal to nature. this occurs when an argument is made that something is good because it is 'natural' or bad because it is 'unnatural', without considering other factors that may influence its effects or desirability. in this case, the statement implies that climate change is not dangerous simply because it is a natural process, disregarding potential harmful consequences and human-induced acceleration of these processes.",False
49,Mr. Governor issues a proclamation for the people of his state to pray for rain.,false causality,"the fallacy most likely present in the context of mr. governor's proclamation is appeal to tradition. this fallacy arises when an argument is considered valid or correct solely due to its historical practice, without taking into account its current relevance or effectiveness. in this instance, the proclamation assumes that praying for rain has been a traditional practice and thus should be followed, despite lacking evidence of its efficacy in producing rainfall.",False
