,text,expected_label,actual_label,result
695,It's extremely individualized.,nothing,"the provided segment, ""it's extremely individualized,"" does not contain enough information to identify a specific logical fallacy. please provide more context or an argument that includes premises and conclusions for better analysis.",False
696,This is why I don't get along with many leftists despite being very far left myself.,nothing,"the given segment demonstrates the fallacy of ad hominem. this fallacy is committed when an argument's validity is questioned based on the characteristics or background of the person making the argument, instead of assessing the merit of the argument itself. in this instance, the speaker is implying that their disagreements with other leftists are due to personal connections, rather than focusing on the actual content or reasoning behind their differing viewpoints.",False
697,"TITLE: 2020 Super Twosday Discussion Live Thread - Part V
POST:",nothing,"thank you for your response. please provide the segment that you would like me to analyze, and i will identify the present fallacy and explain how it manifests in the text.",False
698,Young people who do not vote should be shamed.,causal oversimplification,"rephrased question:
based on the explanation of different types of logical fallacies and the provided segment, which fallacy is present in the following statement?

segment: young people who do not vote should be shamed.

response template:
the statement exhibits an instance of the ad hominem fallacy. this type of fallacy involves attacking the person making the argument rather than addressing the merit or truth of their claim. in this example, instead of examining the possible reasons for young people not voting or how to promote their involvement, the emphasis is placed on shaming those who choose not to vote.",False
699,What can we do to get more young people involved?,causal oversimplification,"the segment does not contain any fallacies. the question ""what can we do to get more young people involved?"" is a valid inquiry seeking suggestions and ideas on how to increase youth involvement. it does not make an argument or claim that is subject to logical fallacy analysis.",False
700,"The barriers today are much less than any other time in history, eg women and people of color segregation and disenfranchisement",causal oversimplification,"the segment contains the fallacy of hasty generalization. this fallacy occurs when a conclusion is drawn based on a small sample size or limited information. in this case, the claim that barriers are much less today than in the past seems to be generalized from a few examples without considering the broader context and persisting challenges faced by women and people of color.",False
701,"
POST: Get older people to stop shaming young people and voting for their own old ass candidates.",nothing,"in response to the list of logical fallacies and the given argument segment, which fallacy is present within the context of the following statement?

segment: 
post: stop shaming young people for not voting in elections; their interests are represented by those who are older.

response template:
the argument contains the fallacy of [fallacy name]. this fallacy occurs when [short explanation of the identified fallacy]. in this case, the fallacy present is ad hominem, as it attacks the age group of young people rather than addressing the substance of their disinterest in voting.",False
702,"TITLE: Slayer's Dave Lombardo Shares Opinion on Metallica's Lars Ulrich
POST: I'm not a musician so bear with me here.",nothing,"the segment does not contain any logical fallacy. the user simply states that they are not a musician and asks for understanding or patience while discussing their opinion. there is no argument being presented, nor is there an appeal to authority or other logical fallacies.",False
703,Why the constant debate about Lars' skills?,nothing,"rephrased question:
considering the content of the given passage, which type of logical error is evident from the list of possible fallacies? please pinpoint and elucidate the particular fallacy present in the text.

segment: ""why do we keep arguing about lars' abilities? it's not like it matters to the overall project outcome.""

response template:
the passage illustrates the fallacy of [fallacy name]. this error occurs when [brief description of the identified fallacy].",False
704,If a successful band in any genre was based only on the very best technical players there would only be a handful of bands out there to listen to right?,nothing,"the segment exhibits the hasty generalization logical fallacy. this error occurs when a conclusion is made based on limited evidence or examples, without considering all relevant information. in this instance, the statement asserts that if a successful band was solely determined by the technical skill of its members, there would be only a small number of successful bands. however, it overlooks other factors such as creativity, marketing, and audience appeal that also contribute to a band's success.",False
705,"
POST: It is fair to say that Lars, in the grand scheme of heavy metal drummers, ranks lower when it comes to technical skills, especially compared to the likes of Lombardo or Menza, and his drumming has only gotten lazier and sloppier with time.",nothing,"the segment contains the fallacy of appeal to authority. this fallacy occurs when a person or source is perceived as having greater credibility due to their authority, status, or expertise in a field, but their argument or point lacks logical support or evidence. in this case, the author seems to be using lars' ranking and comparison with other drummers as an authority on his technical skills, without providing any concrete evidence or reasoning.",False
706,"However, the drumming on the first four albums, especially AFJA, was pretty solid.",nothing,"upon examining the given segment, it does not appear to contain a logical fallacy. the statement seems to be an opinion about the drumming in the first four albums, especially afja, and does not involve any logical inconsistencies or flawed reasoning.",False
707,"The fact is, Lars is responsible for some of the most memorable drum parts in metal (like the machine gun double bass part in One) and he is absolutely indispensable to the songwriting process with James.",nothing,"the segment contains the fallacy of appeal to tradition. this fallacy occurs when an argument is made that something is better because it is traditional, rather than evaluating its merit based on its own inherent value or modern standards. in this case, the claim implies that lars' role in the band is important solely because he has been part of the traditional metal band structure and songwriting process with james.",False
708,"Lars, Kirk and even Cliff have all been criticized for their technical skills, but their creativity, along with James (who is an excellent songwriter and rhythm guitarist), was what made Metallica the greatest metal band of all time, not their chops.",causal oversimplification,"in the given segment, which fallacy can be identified based on the definitions and list of potential logical flaws in arguments?

segment: lars, kirk, and even cliff have all been criticized for their technical skills, but their creativity, along with james (who is an excellent songwriter and rhythm guitarist), was what made metallica the greatest metal band of all time, not their chops.

response template:
the segment demonstrates the ad hominem fallacy. this type of logical error occurs when a person's character or personal traits are attacked instead of addressing the substance of an argument. in this case, focusing on the individual members' technical skills as a criticism of their overall contribution to metallica's success exemplifies ad hominem reasoning.",False
709,"TITLE: China like the interview,but who is Dr.Lobster?",nothing,"**segment:** title: china likes the interview, but who is dr. lobster?

#### response template:
in this segment, the fallacy present is the ad hominem. this fallacy involves attacking the person making an argument rather than addressing the substance of the argument itself. instead of evaluating the content and merits of the interview, the focus is shifted to questioning dr. lobster's credibility or identity, suggesting that their personal background should discredit the value of the interview.",False
710,"
POST: It's a reference to Peterson.",nothing,"the argument contains the fallacy of ad populum. this error in reasoning occurs when an argument's validity is based solely on its popularity or the number of people who support it, rather than evaluating it based on its logical consistency or inherent merit. in this case, the argument assumes that everyone is familiar with peterson without considering factors like personal preferences or knowledge of the subject matter.",False
711,He claimed that hierarchies are good because lobsters have hierarchies as well so it's natural.,nothing,"the statement demonstrates the fallacy of appeal to nature. this fallacy involves asserting that something is true or valid simply because it occurs in nature or aligns with our perception of what is 'natural'. in this segment, the idea that hierarchies are good because they exist in lobster populations is a misleading application of the concept of nature as justification for the argument.",False
712,"
POST: He claimed hierarchies are natural, since we can trace hierarchies to lobsters.",nothing,"the statement provided exhibits the fallacy of causal oversimplification. this type of logical error occurs when a complex phenomenon is attributed to a single cause, when in reality, it may have multiple causes or contributing factors. in this case, the speaker oversimplifies the concept of hierarchy by citing only the example of lobsters and incorrectly assuming that the presence of hierarchies in these animals proves their inherent nature in other contexts as well. this overgeneralization disregards the possibility of other factors influencing the existence or non-existence of hierarchies in different situations.",False
713,"TITLE: [Max Payne 3] Think max might be popping too many painkillers at this point tbh
POST: Max payne had plenty of glitchy craziness, loved it though
POST: Max Payne 3 is such a hidden gem.",nothing,"rephrased question:
based on the content and structure of the provided segment, which logical fallacy can be identified in it according to the list provided?

segment: max payne 3 think max might be popping too many painkillers at this point tbh. max payne had plenty of glitchy craziness, loved it though. max payne 3 is such a hidden gem.

response template:
the segment demonstrates the fallacy of [ad hominem]. this fallacy occurs when an argument is criticized based on personal characteristics or beliefs rather than its substance. by focusing on the person's potential actions (consuming excessive painkillers), the discussion veers away from a meaningful analysis of the game itself and targets the individual instead.",False
714,"The story is awful compared to the previous two games, but the gameplay is fucking fantastic.",nothing,"the segment demonstrates the fallacy of false dichotomy. this fallacy occurs when an argument is presented as if there are only two possible options, while in reality there may be more than two options to consider. in this case, the argument implies that a game can either have a good story or good gameplay, but not both, which oversimplifies the complexity of games and ignores other factors that contribute to their quality.",False
715,The multiplayer was really fun too.,nothing,"in this case, it seems there might be a misunderstanding, as the given statement ""the multiplayer was really fun too"" does not appear to contain any logical fallacies. this statement simply expresses a positive opinion about the multiplayer aspect of an activity or game. however, if you could provide more context or information, i would be happy to analyze it further and identify any potential fallacies.",False
716,"Also, this game has the best flip-flop sandal physics I've ever seen in a videogame thus far.",nothing,"rephrased question:
please analyze the text given and identify the specific argument fallacy present in this particular section.

segment: ""also, this game has the best flip-flop sandal physics i've ever seen in a videogame thus far.""

response template:
the fallacy present in the provided segment is known as [fallacy name]. this fallacy occurs when [short explanation of the identified fallacy].",False
717,TITLE: Scandinavians of reddit: a lot of the internet thinks you live in a perfect fantasy utopia.,nothing,"the fallacy present in the segment is straw man. this fallacy occurs when a person or group's argument or beliefs are misrepresented, simplified, or exaggerated to make them easier to attack or refute. in this case, the statement ""a lot of the internet thinks you live in a perfect fantasy utopia"" misrepresents and oversimplifies the actual beliefs and experiences of scandinavians, making it easier to criticize without addressing their actual arguments or reality.",False
718,What are some issues affecting your countries that the world should know about?,nothing,"the segment does not exhibit any logical fallacy. the question is a genuine inquiry about issues affecting various countries, and it does not employ any specific fallacious reasoning or argumentation.

response template:
the segment does not exhibit any logical fallacy. this fallacy is characterized by [short explanation of the identified fallacy].",False
719,"
POST: I've lived in Denmark for two years.",nothing,the segment does not provide enough information to detect a logical fallacy. please provide an argument with premises and a conclusion for analysis.,False
720,People are pretty difficult to get close to there (quite introverted) so you can easily end up being lonely.,nothing,"the segment contains the fallacy of oversimplification. this fallacy occurs when a complex issue is reduced to a simple explanation, in this case, stating that people are difficult to get close to and one can easily end up being lonely. this overlooks various factors and individual differences that contribute to interpersonal relationships and loneliness.",False
721,The political correctness can be annoying too if you happen to have different political views than most Scandinavians.,nothing,"the segment contains the fallacy of [appeal to contrary]. this fallacy occurs when a conclusion is drawn solely based on an opposing viewpoint or counterexample, without considering the actual evidence or argument. in this case, the statement suggests that political correctness is annoying because people with different views than most scandinavians may find it irritating, rather than discussing the validity or importance of political correctness.",False
722,"
POST: Spot on with the political correctness.",nothing,"the segment contains the fallacy of [generalization]. this fallacy occurs when a conclusion is drawn from insufficient evidence or a broad assumption is made about a whole group based on the characteristics or actions of a few individuals within that group, which is evident in this case as it makes a sweeping statement about the trustworthiness of all people belonging to a certain nationality without considering individual differences and context.",False
723,"I have a couple of quite liberal viewpoints (weed and prostitution should be legal etc), and if my family found out they'd probably all think I was the devil in disguise.",nothing,"the segment contains the fallacy of appeal to consequences. this fallacy occurs when an argument is presented as true or valid simply because it would lead to a particular consequence, without considering whether that consequence is actually relevant or logical. in this case, the speaker assumes that their family's potential reaction to their viewpoints automatically invalidates those viewpoints without addressing the merits of those viewpoints themselves.",False
724,Having an opinion that goes against the grain here is not appreciated in the least.,nothing,"the segment contains the fallacy of ad hominem. this fallacy occurs when a person's character or other irrelevant qualities are attacked rather than the substance of their argument, as seen in this case where the validity of the opinion is questioned based on it going against the grain.",False
725,You say we have issues with our immigration policies?,nothing,"rephrased question:
analyzing the description of different logical fallacies and the given text, can you determine which fallacy is present in the statement ""you say we have issues with our immigration policies?""

**segment:** you say we have issues with our immigration policies?

#### response template:
the segment exhibits the ad hominem fallacy. this fallacy takes place when an argument is discredited or attacked based on the personal characteristics of the person making the argument, instead of addressing the actual content or logic of the argument itself.",False
726,You're a racist.,nothing,"the provided segment displays the fallacy of ad hominem. this type of error occurs when an individual's argument is discredited by attacking their personal characteristics instead of directly addressing the content of the argument itself. in this instance, the person is being accused of being ""racist"" without any substantive discussion or evidence to counter their assertion.",False
727,You say weed should be legal?,nothing,"the segment demonstrates the presence of the ad hominem fallacy. this fallacy occurs when an argument is directed against the person making the argument rather than addressing the substance or validity of the argument itself. in this case, the response attacks the claimant without engaging with the merits of the legalization argument, such as potential benefits or alternative perspectives.",False
728,You're trying to kill our children with drugs.,nothing,"rephrased question:
in a specific debate, can you pinpoint which logical fallacy is present in the following excerpt? please review the list of possible fallacies given.

segment: you're trying to kill our children with drugs.

response template:
the segment contains the fallacy of [fallacy name]. this fallacy arises when [brief description of the detected fallacy].",False
729,You don't want to go to university just so you can use your diploma to become a cashier?,nothing,"the segment contains the fallacy of appeal to tradition. this fallacy occurs when an argument is made that something is better or more valid simply because it has been done in the past, without considering other factors or potential alternatives. in this case, the assumption that a university degree is only worthwhile if used for a specific traditional career path, such as becoming a cashier, demonstrates an appeal to tradition fallacy.",False
730,You're a lazy bum who will never succeed at anything,nothing,"the segment contains the fallacy of ad hominem. this fallacy occurs when someone attacks a person's character or personal traits instead of addressing the actual argument or issue at hand. in this case, the speaker is attacking the individual's character by calling them a ""lazy bum"" rather than discussing the specific topic or argument.",False
731,TITLE: Thinking about getting a bearded dragon so I'm gonna start my research right here in this subreddit.,nothing,"the segment exhibits the fallacy of ad hominem. this fallacy transpires when an individual attacks the character or personal traits of another person instead of addressing their argument, which is what happens in the mentioned segment.",False
732,"
POST: Let me stop you right there...getting information from this subreddit is a sure fire way to ensure you have absolutely no clue what to do.",nothing,"the segment demonstrates the fallacy of ad hominem. this type of logical error occurs when an argument targets the individual making the argument rather than focusing on the validity or substance of their claims. in this instance, the speaker is discrediting the reliability of information from the subreddit by attacking its source, without considering the content's merit.",False
733,"What will happen is you're going to start an argument between 100 different internet ""experts"" all convinced they know what's best for you.",nothing,"the segment contains the fallacy of [appeal to authority]. this fallacy occurs when a speaker or writer uses someone who is not an expert on the subject as though their opinion has value, often misrepresenting them as an authority. in this case, the segment implies that the internet ""experts"" are authorities on what's best for the listener/reader, even though they may not be actual experts in the relevant field.",False
734,Use veterinary sources to guide your thinking.,nothing,"the segment does not exhibit any specific logical fallacy, as it simply encourages trust in scientific consensus to inform one's beliefs. while some might argue that it could be seen as a form of appeal to authority, it is more accurately a statement about the value of relying on evidence-based research and expert opinion in forming beliefs.",False
735,"
POST: Alright good to know, thanks.",nothing,"the provided segment appears to be a simple conversation between two individuals and does not contain any logical errors or fallacies. therefore, there is no fallacy present in this text.",False
736,"But maybe you can help me out with one thing, there are so many pictures with people using paper towels instead of substrate.",nothing,the segment does not contain any obvious fallacies. it is simply a statement suggesting that there are many pictures showing people using paper towels instead of substrate. please provide a list of possible fallacies for analysis.,False
737,Is that at least a thing everybody is okay with?,nothing,"in the provided statement, ""is that at least a thing everybody is okay with?"", which of the following logical fallacies is most likely being employed?

answer: the ad populum fallacy is most likely being employed in this statement. this fallacy occurs when an argument is considered valid or true simply because many people believe it, rather than relying on solid logical reasoning and evidence.",False
738,TITLE: 'Blow Up the Phones': Demands That #BoltonMustTestify Surge After New Revelations About Ukrainian Aid Freeze.,nothing,"the segment does not exhibit a specific logical fallacy, as it is a news title and summary rather than an argument with premises and conclusions. logical fallacies typically involve flawed reasoning or deceptive tactics in arguments.",False
739,"""We are citizens of the United States of America, and we must indeed unite together to stop this GOP cover-up.""
POST: Cover up of what?",nothing,"rephrased question: please analyze the description of different types of logical errors and the provided text to identify which type of flawed reasoning is present in the given passage.

#### response template:
the text exemplifies [fallacy name]. this fallacy occurs when [short explanation of the identified fallacy]. the segment clearly illustrates the key feature(s) of this particular logical error, making it a clear example of that specific fallacy.",False
740,"
POST: Trump using taxpayer dollars appropriated by Congress to bribe Ukraine into helping his reelection campaign",nothing,"the segment demonstrates the presence of the false cause fallacy. this fallacy is characterized by the fact that it involves attributing a cause to an event or phenomenon based on an incorrect assumption, rather than providing evidence or logical reasoning. in this case, the assumption is made that trump's use of taxpayer dollars appropriated by congress for bribing ukraine is directly causing his reelection campaign to benefit.",False
741,"TITLE: Yes, this is a poll about raiding and instances.",nothing,"rephrased question:
considering the outlined definitions of various types of logical errors, which fallacy can be observed in the provided argument? please review the list of fallacies and examine the text to determine which one is present.

text: title: ""is it true that raiding and instances are connected?""

response template:
the given text exemplifies the fallacy of [fallacy name]. this fallacy occurs when [a brief explanation of the identified fallacy in context]. the text illustrates a problematic method of assessing or comprehending the connection between raiding and instances.",False
742,"
POST: There is a compromise: Popped bosses.",nothing,"rephrased question:
in the given argument segment, what type of logical error is present, and what are its key features? please specify the particular fallacy and offer a concise description.

segment: there is a compromise: popped bosses.

response template:
the segment involves the fallacy of [fallacy name]. this fallacy is characterized by [short explanation of the identified fallacy].",False
743,You do a bunch of stuff/farming/crafting to assemble an item that will spawn the boss in the open world.,nothing,"the provided segment does not contain a logical fallacy, as it is simply stating a process or action to be performed in order to generate a boss in an open world. there is no flawed reasoning or incorrect assumption being made within this statement.",False
