,text,expected_label,actual_label,result
193,"German Shepherds are dogs; therefore, German Shepherds would be good inside dogs, too.",false analogy,"upon examining the segment, it appears that the fallacy present is hasty generalization. this fallacy occurs when a conclusion is drawn based on a small sample size or an insufficient amount of information. in this case, the assumption is made that because german shepherds are dogs, they would also be good as inside dogs without considering other factors or additional evidence that may influence their suitability for indoor living.",False
194,"TITLE: Explain why you find sausages, lasagna, steak, and tacos delicious like I am your crazy extremist vegan girlfriend who believes eating cheese, let alone meat, is worse than the holocaust.",nothing,"the segment exhibits the fallacy of appeal to extreme. this type of logical error involves utilizing an overly exaggerated or extreme example to support a point, which can lead to oversimplification or misrepresentation of the actual argument. in this instance, likening the consumption of meat and cheese to the holocaust serves as an excessive analogy that does not accurately capture the ethical concerns related to animal agriculture and food choices.",False
195,POST:,nothing,"rephrased question:
taking into account the descriptions provided for logical errors and deceptive techniques, what kind of error in reasoning or misleading tactic is evident in the specified section, and how does it appear within that section?

segment: post: [insert segment here]

response template:
the provided segment showcases an instance of the fallacy known as [fallacy name]. this type of fallacy involves [brief explanation of the identified fallacy], which is noticeable in the segment through [particular example or pattern from the segment].",False
196,"Most animals, including humans are meant to consume meat.",appeal to nature,"the segment demonstrates the presence of the ""appeal to nature"" or ""naturalistic fallacy."" this fallacy arises when an argument assumes that what occurs in nature is inherently good, desirable, or morally right. in this case, the statement implies that because most animals consume meat, it is natural and therefore acceptable for humans as well. however, this does not necessarily mean that consuming meat is morally or ethically justified.",True
197,Humans would've probably died out by eating vegetables alone.,appeal to nature,"the fallacy present in the given segment, ""humans would've probably died out by eating vegetables alone,"" is hasty generalization. this fallacy occurs when a conclusion is drawn based on a small sample size or limited evidence. in this case, the statement implies that humans could not survive solely on a vegetarian diet without sufficient evidence to support such a claim.",False
198,So why not doing what we were meant to do by enjoying some salmon?,appeal to nature,"in the given argument segment, the specific logical fallacy being employed is the appeal to nature. this fallacy involves making a claim that something is good or true solely based on its natural origins, disregarding the fact that something being 'natural' does not necessarily imply it is beneficial or accurate.",True
199,Or do you actually think fish is okay since you don't think they look cute?,appeal to ridicule,the segment demonstrates the presence of the **ad hominem** fallacy. this fallacy occurs when a person attacks the character or personal traits of someone instead of addressing the substance of their argument.,False
200,The United States is the wealthiest nation in the world.,fallacy of division,"the segment does not demonstrate any logical fallacy as it is simply a statement of fact, without any argument or reasoning.",False
201,So every American is wealthy.,fallacy of division,"the segment contains the fallacy of hasty generalization. this fallacy occurs when a conclusion is drawn based on a small sample size or insufficient evidence, leading to an inaccurate generalization about a larger group. in this case, the statement ""so every american is wealthy"" makes a broad and incorrect assumption about all americans based on potentially limited or biased information.",False
202,"Sam is riding her bike in her home town in Maine, minding her own business.",nothing,"the provided text does not contain a logical fallacy, as it is simply describing a situation without making any argument or presenting any claim that could be subject to fallacious reasoning.",False
203,A station wagon comes up behind her and the driver starts beeping his horn and then tries to force her off the road.,nothing,"the provided argument segment does not seem to contain a logical fallacy, as it appears to be describing a scenario rather than presenting an argument with a specific claim and reasoning. a logical fallacy would involve an error in reasoning that leads to a false or unsound conclusion.

however, if we were to assume this segment is part of a larger argument and try to identify a potential fallacy, it could be argued that the scenario might imply a slippery slope fallacy. the slippery slope fallacy occurs when it's assumed that one event will lead to a chain of related events culminating in an extreme or undesirable outcome, without proper justification for this assumption.

in this case, the segment does not explicitly state that the driver beeping his horn and trying to force her off the road would lead to some catastrophic outcome. it simply describes a single event.",False
204,"As he goes by, the driver yells""get on the sidewalk where you belong!"" Sam sees that the car has Ohio plates and concludes that all Ohio drivers are jerks.",hasty generalization,"the segment demonstrates the fallacy of hasty generalization. this fallacy is present when a conclusion is drawn based on limited evidence or a single instance, as in this case where sam concludes that all ohio drivers are jerks based on one encounter with a driver from ohio.",True
205,"TITLE: Florida officer planted drugs on over 100 victims: DA has not moved to vacate any charges against his victims, some of whom are still imprisoned[2019] POST: Wow, over 100 victims...",nothing,"the segment contains the fallacy of appeal to ad populum. this fallacy occurs when an argument is deemed valid or true solely because a large number of people believe in it. in this case, the presence of ""wow, over 100 victims"" suggests that the author is implying the truth of the claim just because many people were affected by it.",False
206,that's horrible.,nothing,the provided segment does not contain enough information or context to identify a specific fallacy. please provide more details or context for the argument in question.,False
207,"What was the motive behind such a terrible way of life, and personality?",nothing,"the provided argument segment does not seem to contain any specific logical fallacy. however, it can be interpreted as an example of a [hypothetical fallacy], which occurs when a question or statement assumes something as true without providing sufficient evidence. in this case, the segment assumes that there is a ""terrible way of life and personality"" without explaining why this is so.",False
208,POST:,nothing,"i am sorry, but there doesn't seem to be any provided list of logical fallacies or an argument segment for me to analyze. please provide the necessary information so that i can help you identify the fallacy and explain why it is present in the segment.",False
209,Advancement and maybe kickbacks?,false dilemma,"the argument appears to exhibit the fallacy of ambiguity. this fallacy occurs when a statement or question contains words with multiple meanings, leading to confusion and potentially misleading conclusions. in this case, ""advancement and maybe kickbacks?"" is unclear as it could refer to either personal advancements in career or progress in a particular field, or the possibility of receiving illicit payments (kickbacks) for providing favors or advantages.",False
210,Either that or he's just a psychopath who gets off on destroying people's lives.,false dilemma,"rephrased question:
examine the given sentence and, using the list of potential fallacies and their explanations, identify the fallacy present in this statement:

sentence: either that or he's just a psychopath who gets off on destroying people's lives.

#### response template:
the provided segment displays the fallacy of [fallacy name]. this fallacy occurs when [short description of the identified fallacy]. in this instance, the statement presents a false dichotomy by confining the possible explanations to two mutually exclusive alternatives, which may not adequately portray the intricacies of the situation.",False
211,Either way this asshole should never see the light of day again.,false dilemma,"the segment displays an example of the ad hominem fallacy. this type of logical error involves attacking a person rather than addressing the content of their argument or the subject matter. in this instance, the statement ""either way, this asshole should never see the light of day again"" directs its criticism towards the individual involved, rather than focusing on the validity of their argument or the topic being discussed.",False
212,"only man is rational no women is man Therefore, no women is rational",equivocation,"the segment contains the fallacy of [equivocation]. this fallacy occurs when a term's meaning is subtly or ambiguously altered within an argument, leading to a misleading or incorrect conclusion. in this case, the phrase ""no women is man"" has equivocated the word ""man"" to mean both a gender and a species, allowing for a deceptive comparison between men and women. by using ""man"" in this way, the statement implies that if a person is not a man (as a gender), then they are not rational, which is an oversimplification of the human experience and capabilities.",True
213,You should never gamble.,slippery slope,"upon examining the statement ""you should never gamble,"" it appears that there is no identifiable fallacy. however, if we were to consider an argument such as ""you should never gamble because it always leads to financial ruin,"" then the fallacy present would be a hasty generalization. this fallacy occurs when a conclusion is drawn based on insufficient or incomplete evidence, implying that all instances of gambling will result in financial ruin, which is not necessarily true.",False
214,Once you start gambling you find it hard to stop.,slippery slope,"the statement ""once you start gambling you find it hard to stop"" exhibits the logical fallacy known as the slippery slope. this fallacy arises when an argument posits that a minor action or choice will inevitably lead to a succession of increasingly severe outcomes, without presenting convincing evidence to support this chain of events.",True
215,"Soon you are spending all your money on gambling, and eventually you will turn to crime to support your earnings.",slippery slope,"in this argument, the fallacy of slippery slope can be identified. the slippery slope fallacy occurs when a small action or event is claimed to inevitably lead to an extreme or disproportionate outcome, without providing adequate evidence or logical connection between the two.",True
216,"If it is very low, for instance around one, it means greenhouse gas emissions are simply not worth doing anything about.",false dilemma,"the provided text contains an example of the false cause logical fallacy. this fallacy occurs when a correlation between two events is incorrectly assumed to imply causation, without providing evidence for a direct relationship. in this case, the argument suggests that if greenhouse gas emissions are ""very low"" (around one), then there is no need for any action or concern about them. however, it does not provide sufficient evidence to support this claim, and ignoring the issue due to its perceived ""low"" level could still lead to negative consequences in the future.",False
217,"But if ECS is high -- say, around four degrees or more -- then climate change is probably a big problem.",false dilemma,"rephrased question:
considering the description of different logical fallacies and the provided segment, can you identify which fallacy is present in the mentioned segment?

segment: if ecs is high -- say, around four degrees or more -- then climate change is probably a big problem.

response template:
the segment demonstrates the fallacy of hasty generalization. this error occurs when a conclusion is reached based on a limited sample size, and in this instance, the conclusion that climate change is a major issue is drawn solely from ecs being high (around four degrees or more), without considering other factors or larger context.",False
218,"We may not be able to stop it, but we' d better get ready to adapt to it.",false dilemma,"the provided segment does not demonstrate any logical fallacy. it is a statement suggesting preparedness for potential changes or challenges that may be beyond our control, without making assumptions about the severity of these changes or their inevitable occurrence.",False
219,TITLE: Vote Leave fined and reported to police by Electoral Commission - The Guardian POST: Two groups working towards the same goal shared some information.,nothing,"the segment does not contain a specific logical fallacy, but rather states a fact about vote leave being fined and reported to police by the electoral commission. the second sentence is an observation that two groups working towards the same goal shared some information. no logical fallacy can be identified based on this description and list of possible fallacies.",False
220,Big deal.,nothing,"rephrased question:
given a specific argument segment and a list of logical fallacies, can you identify which fallacy is present in the following segment: ""big deal.""?

**segment:** big deal.

#### response template:
the segment demonstrates the ad hominem fallacy. this fallacy arises when someone targets the individual making the argument rather than focusing on the validity of the argument itself. by implying that the arguer's character or background renders their position invalid, it diverts attention from the substance of the argument. in this instance, ""big deal"" avoids addressing the content or reasoning of the argument and instead attacks the arguer.",False
221,"Hopefully the police will use their resources on more serious issues such as knife crime, drug gangs and scooter criminals.",appeal to worse problems,"the segment contains the fallacy of ad hominem. this fallacy occurs when an argument attacks the person making the argument rather than addressing the substance of their claim. in this case, the speaker is attacking ""scooter criminals"" as a group, without directly addressing or refuting the actual content of their argument. however, it's important to note that there is no attack on a specific person in this segment, so the ad hominem fallacy may not be the most accurate classification. instead, the fallacy could be better described as a straw man fallacy. this occurs when someone misrepresents another person's argument in order to more easily refute it. in this case, the speaker is implying that ""scooter criminals"" are the only issue at hand, while ignoring other potential concerns like knife crime and drug gangs. by focusing on a straw man (the scooter criminals), they avoid addressing the broader topic of police resource allocation and how it should be used more effectively.",False
222,"TITLE: Bigfoot reportedly seen, going INSIDE a UFO.",nothing,i cannot provide a response without the provided segment and listed fallacies. please provide the segment and the list of fallacies for me to analyze and identify the observed fallacy.,False
223,This has got to be the strangest thing I have came across.,nothing,"the segment contains an example of the fallacy of appeal to popularity. this fallacy occurs when an argument is considered valid or true based on its widespread belief or acceptance, rather than evaluating it using logical reasoning and evidence. in this case, the statement implies that the statue is being given undeserved credit due to widespread support for the individual, disregarding their actual accomplishments and qualifications that would justify such recognition.",False
224,"Were the Missing, brought inside the UFO, too?",nothing,the given segment does not provide enough information or context to identify a specific fallacy. please provide a statement and list of potential logical errors for analysis.,False
225,"POST: Interesting story, but sadly no substantial evidence.",nothing,"the segment demonstrates the fallacy of ad hominem. this fallacy occurs when an individual attacks the character or personal traits of another person, rather than addressing their argument or ideas. in this case, the commenter is criticizing the credibility of the story without providing any counter-argument or evidence to support their point.",False
226,Mostly likely a lie for attention.,nothing,"the segment demonstrates the fallacy of ad hominem. this type of logical error occurs when an argument is dismissed or rejected based on the character, motive, or other irrelevant attributes of the person presenting the argument, instead of examining the validity of the content itself. in this instance, the statement ""mostly likely a lie for attention"" suggests that the speaker considers the claim to be false because of their opinion about the person making it, rather than analyzing the strength and supporting evidence of the assertion.",False
227,POST:,nothing,"**segment:** ""all humans are mortal, and socrates is a human. therefore, socrates must be mortal.""

#### response template:
the segment demonstrates the use of the affirming the consequent fallacy. this type of fallacy occurs when a conclusion is assumed to be true based on the assumption that the premises lead to that conclusion, regardless of whether the premises are actually true or not.",False
228,From a practicing judge?,ad hominem,"rephrased question: 
can you please recognize and elucidate the specific illogical reasoning in the presented argument section, using a list of prevalent logical errors as a guide?

segment: the contention or assertion under analysis.

response template: 
the mentioned argument embodies the fallacy of [fallacy name]. this fallacy transpires when [concise description of the identified fallacy].",False
229,"TITLE: The only conspiracy theory I accept POST: Post is same age as me and hes make bills while I'm slaving away at school and work POST: Yeah, but if youre on Reddit you're probably not one of the millions upon millions of people who are starving or hungry or living in one of the shit holes of the world.",nothing,"the provided segment commits the fallacy of ad populum. this occurs when an argument is supported by claiming that many people believe it, rather than providing logical reasoning or evidence. in this case, the post suggests that those who use reddit are unlikely to experience severe poverty, based on the assumption that belonging to a specific group (using reddit) equates to a certain lifestyle or situation.",False
230,Or at least that's my guess.,nothing,"the provided segment demonstrates the fallacy of ad hominem, which occurs when an argument is invalidated based on its source or presenter rather than examining the content of the argument itself. in this case, the statement ""people say that eating chocolate helps with stress, but that's just an old wives' tale"" discredits the belief about chocolate and stress relief solely because it is a widely held belief among many individuals.",False
231,"So don't be upset someone is your age and way luckier than you, be thankful you weren't born into worse circumstances because there are likely plenty.",appeal to worse problems,"in the given sentence, ""so don't be upset someone is your age and way luckier than you, be thankful you weren't born into worse circumstances because there are likely plenty,"" the fallacy present is appeal to worse problems. this fallacy arises when an argument attempts to invalidate a problem or concern by emphasizing that there are even larger issues at hand.",True
232,"Also, fun fact, they've done studies and if you make around $80k in the US anything beyond that doesn't really contribute to your overall happiness.",nothing,"the statement exhibits the fallacy of causal oversimplification. this fallacy occurs when a single cause is attributed to an outcome, despite multiple factors contributing to it. in this case, the statement oversimplifies the relationship between income and happiness by implying that once an individual reaches $80k in the us, further increases in income have no impact on their overall happiness.",False
233,I think what's cooler about Post Malone and other wildly successful people is they are doing what they love doing.,nothing,"the segment does not appear to contain any obvious fallacies. it states a belief about the popularity of video games and provides a reason for this popularity, which is that they provide a fun and entertaining way to pass time. however, without further context or information, it is difficult to determine if there are other aspects of the argument that might be considered fallacious.",False
234,That's real success.,nothing,the argument does not provide enough information to identify a specific fallacy. please provide a complete argument or context for a proper analysis.,False
235,And you don't need to be a millionaire to have it.,nothing,"the segment seems to employ a fallacy of hasty generalization. this fallacy occurs when a conclusion is drawn based on a small sample size or insufficient evidence, resulting in an overgeneralized statement. in this instance, the assertion that ""you don't need to be a millionaire to have it"" might be derived from a limited set of examples or anecdotal evidence, and therefore cannot be generalized to encompass all situations or individuals.",False
236,We know God exists because he made everything,circular reasoning,"the segment displays the fallacy of appeal to nature, also known as ""argumentum ad naturam."" this fallacy is characterized by the assumption that something must be true because it exists in nature or is a part of the natural world, which ultimately leads to an invalid or weakened argument. in this case, the argument assumes that the existence of everything proves the existence of god, without providing any logical evidence or reasoning.",False
237,TITLE: Incel gets into relationship POST: Its almost like virginity has no bearing on who you are as a person and once you lose it you're still the same as you were before...,nothing,"the provided segment exhibits an instance of the hasty generalization fallacy. this type of logical error occurs when a broad conclusion is drawn from a small sample or insufficient evidence, without adequately supporting the claim. in this case, the assertion ""virginity has no bearing on who you are as a person"" is based on a limited perspective of personal identities and relationships.",False
238,POST:,nothing,"in order to rephrase the question and provide a response template, we first need the segment or argument that needs to be analyzed for fallacies. please provide the segment or argument you'd like me to examine.",False
239,2 chicks rejected me for being a virgin.,hasty generalization,"the segment contains the fallacy of [false cause]. this fallacy occurs when an incorrect cause is attributed to an event or outcome, rather than considering other potential reasons. in this case, the statement implies that the reason for being rejected by two individuals was solely due to being a virgin, without considering other possible factors that could have contributed to their decision.",False
240,I had sex as soon as I started lying about having had sex.,hasty generalization,"the example sentence exhibits the fallacy of post hoc ergo propter hoc. this fallacy occurs when someone assumes that because one event occurred before another event, the first event must have caused the second event to occur. in this case, the statement demonstrates a causal oversimplification by attributing the action of lying to the act of having sex, without considering other possible reasons for lying.",False
241,"And all those weren't even casual sex, it was in the frame of relationships.",hasty generalization,"the statement contains the fallacy of [appeal to tradition]. this fallacy occurs when an argument is made that something is better or more acceptable simply because it is traditional. in this case, the speaker assumes that because these instances of sexual activity were within the context of relationships, they are inherently superior or more justified than casual sex. however, this does not necessarily hold true as the value and morality of sexual activities depend on individual perspectives and consensual agreements.",False
242,Apparently it holds bearing on who you are as a person and you're not the same person when you loose it.,hasty generalization,"the segment exhibits the fallacy of slippery slope, which occurs when a small change or action is assumed to lead to a disastrous or unwanted outcome without proper evidence or reasoning.",False
243,I know that our TV advertisements are more effective than radio.,nothing,the segment does not provide enough information to identify a specific fallacy. please provide a full argument for better analysis.,False
