,text,expected_label,actual_label,result
448,James' mom is concerned when she finds out that he skipped class one day.,slippery slope,"in the given segment, no specific logical fallacy is present. the statement simply describes a situation where james' mom is concerned about him skipping class. to identify a logical fallacy, we would need to examine an argument or claim that uses flawed reasoning or illogical premises.",False
449,"She tells him that she is concerned that since he skipped one class, he will start skipping more frequently.",slippery slope,"rephrased question:
in light of the description of an argument and the collection of possible fallacies, which fallacy can be detected in the following statement?

statement: she expresses her worry that if he misses one class, he will begin to skip more often.

response template:
the statement demonstrates the fallacy of hasty generalization. this fallacy takes place when a conclusion is derived from a small sample size or an insufficient number of instances to accurately represent the entirety. in this instance, the concern that missing one class will result in regular skipping is making a broad assumption based on a limited example, without considering other factors or potential differences in individual behavior.",False
450,"Then he will drop out altogether, never graduate or get into college, and end up unemployed and living at home for the rest of his life.",slippery slope,"rephrased question:
in the given section, can you pinpoint which type of logical error is being used according to the provided list of erroneous reasoning?

segment: then he will drop out altogether, never graduate or get into college, and end up unemployed and living at home for the rest of his life.

response template:
the passage exemplifies a case of the slippery slope fallacy. this fallacy emerges when a small action is depicted as resulting in extreme and often unrealistic outcomes, without substantial proof or logical connection between the stages involved.",True
451,"TITLE: The more corrupt the state, the more numerous the laws.",nothing,"upon examining the statement, it becomes clear that the fallacy of false cause (post hoc ergo propter hoc) is present. this fallacy takes place when one mistakenly assumes a cause-and-effect relationship between two events or conditions without sufficient evidence to support this assumption. in this case, the statement incorrectly implies that an increase in corruption leads directly and necessarily to an increase in laws, when there could be other factors at play.",False
452,- Tacitus[529x529] POST:,nothing,"the provided definitions of argument fallacies are not given in the context, but i can identify a common fallacy in the segment if you provide it.",False
453,So the least corrupt state is anarchy by this logic.,equivocation,"the provided segment demonstrates the fallacy of false cause. this fallacy occurs when a conclusion is assumed to be true simply because it is believed to follow from a particular premise or circumstance, without any proper justification or reasoning. in this case, the assumption that ""the least corrupt state is anarchy"" is made without any solid evidence or logical connection established between the two concepts.",False
454,"This is""deep"" libertarian bullshit.",guilt by association,"the fallacy present in this segment is the appeal to emotion. this occurs when an argument relies on evoking strong emotions rather than using logical reasoning or evidence to support the claim. in this instance, the term ""bullshit"" is used to trigger a negative emotional response towards libertarian ideas, as opposed to presenting a reasoned analysis or counterargument.",False
455,"Yes, over regulation is a thing, but laws against theft, murder, slavery, child labor, education, etc.",nothing,"the segment does not provide enough information to clearly identify a specific fallacy. however, it seems to contain an argument by assertion or a straw man fallacy. it appears to imply that over-regulation is inherently bad without providing any reasoning or evidence, and the list of laws mentioned may be a straw man, oversimplifying the issues at hand.",False
456,are good things - not corruption.,nothing,"the provided segment exhibits the logical fallacy known as ""hasty generalization."" this fallacy takes place when a person makes a broad claim about a whole category based on limited information, personal experiences, or isolated instances, without considering the variety and complexity within that group. in this case, the statement ""all politicians are corrupt"" overgeneralizes the entire political class based on the actions of some individuals within it, disregarding the diverse range of characteristics and behaviors found among politicians.",False
457,"POST: > laws against theft, murder, slavery.",nothing,"the provided text presents an example of the hasty generalization fallacy. this type of fallacy occurs when a conclusion is drawn based on insufficient evidence or a limited sample size, without considering alternative viewpoints or the specific circumstances in which certain regulations might be needed. in this case, the statement claims that laws against theft, murder, and slavery are essential for maintaining a just society, but it does not provide adequate reasoning or evidence to support this claim.",False
458,"Good people don't need laws to tell them how to be good, bad people either ignore laws or use/create them to hide behind...",circular reasoning,"the segment demonstrates the fallacy of hasty generalization. this fallacy occurs when a conclusion is drawn based on a limited or insufficient sample size, resulting in an oversimplified understanding of the issue and not taking into account the full complexity of the situation. in this instance, the statement implies that all good people do not require laws to guide their behavior, while in reality, the connection between morality and law is more intricate and can differ across individuals.",False
459,TITLE: Stores should have a few for people who shop after closing POST: I mean 10 minutes after closing isn't really bad at all.,nothing,"the statement appears to exhibit the fallacy of hasty generalization. this fallacy occurs when a conclusion is drawn based on a small sample size or limited information, in this case, suggesting that 10 minutes after closing time is acceptable for everyone without considering individual experiences or store policies.",False
460,POST:,nothing,"in order to identify the fallacy in the provided argument segment, please insert the argument segment in the space provided above. once you have done that, i will be able to analyze the argument and determine which logical fallacy is present, as well as provide a brief explanation of how it fits into that category.",False
461,"Well if 10 minutes isnt bad, then surely 11 is ok.",slippery slope,"the segment involves the fallacy of hasty generalization. this error happens when a conclusion is drawn from a small sample size or limited evidence, instead of taking into account the whole context and available information. in this instance, the assertion that if 10 minutes isn't bad, then 11 must be fine exhibits an overgeneralization based on a minimal difference between two values.",False
462,If 11 is ok then 13 is fine.,slippery slope,"the segment demonstrates the presence of the fallacy of false analogy. this particular fallacy occurs when a comparison is made between two things that are not truly comparable due to a lack of relevant similarities or differences. in this case, the argument assumes that if 11 is acceptable, then 13 should also be considered acceptable. however, the conclusion does not account for any differences or context between the two numbers, leading to an overly simplistic view.",False
463,If 13 is fine then whats wrong with 15.,slippery slope,"after analyzing the provided segment, it appears to contain the fallacy of hasty generalization. this is because the conclusion is drawn based on a small sample size or limited evidence. the argument jumps from the number 13 to the number 15 without providing any substantive reasoning or justification for the leap.",False
464,"You said 15 is ok, 16 is just a minute more.",slippery slope,"the segment contains the fallacy of hasty generalization. this fallacy occurs when a conclusion is drawn based on a small sample size or limited evidence. in this case, the statement assumes that because 15 is considered acceptable, adding one more instance (16) should not be significant. however, without considering other relevant factors and information, making such a generalization could be misleading.",False
465,"Were at 16, Im finishing up and will be checked out by 18.",slippery slope,"the segment does not contain any logical fallacies. it is a simple statement about someone's progress and expected completion time, without any faulty reasoning or illogical conclusions.",False
466,See how it keeps getting stretched out?????,slippery slope,"the provided segment does not appear to be a logical argument, and thus cannot demonstrate any fallacies. please provide a segment that includes a logical argument for me to identify any potential fallacies present.",False
467,When the goddamned sign says the store closes at 9:00 the fucking customers need to get the fuck out by 8:59.,causal oversimplification,"the provided segment does not demonstrate any specific logical fallacies, as it is primarily an expression of frustration rather than an argument with a premise and conclusion.",False
468,They had all day to get their shit taken care of.,causal oversimplification,"the given segment demonstrates the fallacy of circular reasoning. this fallacy takes place when an argument is based on a premise that is equivalent to or derived from the conclusion it is meant to support, without providing any additional evidence or justification. in this case, the statement assumes that they had all day to get their tasks done and implies that if they didn't, it must be because they chose not to. however, this doesn't provide any evidence or explanation for why they didn't complete their tasks, and therefore employs a circular reasoning fallacy.",False
469,At 9 0 0 youre on my time.,appeal to anger,the provided segment does not contain a specific fallacy. please provide a segment or question for me to analyze.,False
470,Three congressional representatives have had affairs.,hasty generalization,"the statement demonstrates the fallacy of appeal to tradition. this fallacy emerges when an argument asserts that something ought to be considered correct or appropriate due to its historical precedence, without taking into account its significance or relevance in the present day. in this instance, the claim that having affairs is a concern for congressional representatives stems from a conventional perspective rather than evaluating the current situation and the potential ramifications of such behavior.",False
471,Members of Congress are adulterers.,hasty generalization,"rephrased response:
the statement ""members of congress are adulterers"" appears to make a generalized claim about all members of congress, suggesting that they are unfaithful in their relationships. this segment likely contains the fallacy known as hasty generalization or overgeneralization. 

a hasty generalization is a logical fallacy that occurs when one draws a conclusion based on insufficient evidence or makes an overly broad claim about a group, without considering individual differences within that group. in this case, the statement implies that all members of congress are unfaithful in their relationships, which is an overgeneralization based on potentially limited evidence or personal biases. it is important to remember that making claims about entire groups can be misleading and often neglects the diversity of opinions, behaviors, and actions within those groups.",True
472,"TITLE: Tennessee Senator calls higher education a'liberal breeding ground,' calls to remove it all together POST:",nothing,the segment displays the fallacy of ad hominem. this fallacy is characterized by attacking a person's character or personal traits rather than addressing the substance of their argument.,False
473,So he's saying liberals are better educated than conservatives.,equivocation,the segment appears to be missing a specific claim or argument for us to identify any logical error or fallacy. please provide a complete segment with a clear statement for analysis.,False
474,We agree.,equivocation,"rephrased question:
which logical fallacy is present in the provided text segment, and could you explain how this fallacy manifests in that text?

segment: ""we agree.""

response template:
the fallacy of ad populum is present in the text segment. this occurs when an argument is deemed valid or true solely based on widespread belief, without presenting any strong evidence or logical reasoning. in this instance, the statement ""we agree"" suggests that the speaker's viewpoint is correct because many people endorse it, rather than providing a solid and reasoned argument for their stance.",False
475,Trump isn't the only one who loves the poorly educated.,equivocation,"the segment demonstrates the fallacy of [ad hominem]. this type of logical fallacy occurs when an argument is attacked by targeting the person making the argument rather than addressing the substance or validity of the argument itself. in this instance, the emphasis on ""the poorly educated"" as a group aims to undermine the argument instead of engaging with its content.",False
476,"Or, more accurately, many liberal professors abuse their positions by attempting to force their political opinions into subjects they don't belong in, like the English professor who insists their students each write a paper on""Why the GOP are terrorists"" and grade students poorly who disagree with that opinion (experienced that first hand).",hasty generalization,"the segment contains the fallacy of appeal to anecdote. this fallacy occurs when an argument is based on personal experiences or isolated cases, rather than on objective evidence or general principles. in this case, the author is basing their claim about liberal professors on a single experience they had with an english professor, which does not necessarily represent the actions or beliefs of all liberal professors.",False
477,"Many of the big name institutions have become incestuous single minded orgies which no longer challenge students to think out of the box, challenge assumed truths and seek to learn all they can, but instead have become factories to produce a very specific set of opinions and mindsets never to be questioned.",nothing,"the specific logical fallacy observed in the provided text is appeal to adversary. this fallacy arises when an argument is made by emphasizing a negative or undesirable outcome associated with a particular action or belief, without offering any substantive evidence or valid reasoning to support this assertion. in the presented argument, the author employs the unsavory nature of ""incestuous single minded orgies"" as a means to criticize educational institutions, without providing concrete examples or evidence to back up their criticism.",False
478,"This isn't a call to abolish higher learning, but I think the entire system needs to be reassessed, not only due to outrageous costs and access issues.",nothing,"the segment does not explicitly contain an appeal to fear fallacy. instead, it seems to present a concern about the current state of the higher education system due to high costs and access issues. however, if one were to interpret the statement as implying that not reassessing the system would lead to the abolition of higher learning, then it could be seen as an example of the slippery slope fallacy, where a small action is assumed to lead to a disastrous chain of events without adequate justification.",False
479,"TITLE: What""healthy"" food is actually way more unhealthy than most people think?",nothing,"the segment demonstrates the presence of the slippery slope logical fallacy. this fallacy occurs when an argument is made that a small, often unrelated, change will lead to a disastrous and uncontrollable series of events, even though there is no evidence to support this claim.",False
480,POST:,nothing,"i'm sorry, but it seems like there was a mistake in your request. you didn't provide any text or information for me to analyze and identify a fallacy from the list. please provide a segment of text or more details about the situation you are asking about, so i can help you with your query.",False
481,Incoming comments of things that are nutritious but people don't consider healthy because they're high in calories AND other random shit they read on a blog who's ultimate goal is to convince them to spend money on something at some point.,appeal to ridicule,"in the given segment, a specific type of fallacy called ""appeal to fear"" can be identified. the fallacy of appeal to fear is when an argument relies on evoking fear in the audience instead of using logical reasoning. in this case, the segment seems to imply that people perceive certain foods as unhealthy because they are influenced by a blog that aims to persuade them into buying something. this manipulation of perception through fear can be considered an example of the appeal to fear fallacy.",False
482,Olive oil is healthy even though it has calories and fruit is healthy even though it has carbs.,nothing,"the segment demonstrates a fallacy of hasty generalization. this fallacy arises when a conclusion is reached based on insufficient evidence or limited data, instead of considering all relevant information or data. in this example, the assertion assumes that because olive oil and fruit contain specific nutrients (calories and carbs), they are inherently healthy without accounting for their overall composition and other factors that could impact their health benefits.",False
483,Dairy and red meat are fine - people have been consuming them for centuries and they did shit like building pyramids using just their hands.,appeal to tradition,"the segment contains the fallacy of appeal to tradition. this fallacy occurs when an argument is presented as valid or correct because it has been practiced or followed historically, without considering other factors or evidence that may suggest otherwise. in this case, the claim about dairy and red meat being fine is based on the tradition of consuming them for centuries, rather than evaluating their potential health effects or other modern considerations.",True
484,"You don't need to live off of bland chicken breasts, broccoli, and scrambled eggs to be healthy.",straw man,"the segment contains the fallacy of false dichotomy. this fallacy occurs when an argument presents only two options as if they are the only possible choices, when in reality there may be other alternatives available. in this case, the statement suggests that one must either live off bland chicken breasts, broccoli, and scrambled eggs or not be healthy, ignoring the possibility of a more diverse and flavorful healthy diet.",False
485,Also people need to learn the difference between added sugar and natural sugar.,nothing,"the segment does not contain a clear fallacy, as it is merely making a statement about the importance of understanding the difference between added sugar and natural sugar. however, if this statement were to be used in a larger context or argument, it could potentially be associated with various fallacies depending on how it's framed or used. please provide a full sentence or argument for a more accurate analysis.",False
486,The sugar in fruit is not the same sugar in candy bars.,nothing,"the segment contains the fallacy of equivocation. this fallacy occurs when ambiguous language is used to mislead or misrepresent the truth, and in this case, it's implied that both the sugar in fruit and the sugar in candy bars are the same substance despite having different names. the statement equivocates on the term ""sugar"" by not distinguishing between naturally occurring sugars found in fruits and the refined sugars added to candy bars.",False
487,I think one of the biggest reasons for the obesity epidemic in America is the over-complication of nutrition.,causal oversimplification,"the given segment contains the fallacy of oversimplification. this fallacy occurs when a complex issue is reduced to a single, overly simplistic cause or explanation. in this case, the argument suggests that the overcomplication of nutrition is the main reason behind the obesity epidemic in america, ignoring other factors such as lack of physical activity, genetic predispositions, and socioeconomic factors.",False
488,"A new food is""unhealthy"" every week.",appeal to ridicule,"in the given statement ""a new food is 'unhealthy' every week,"" the fallacy present is a hasty generalization. this occurs when a conclusion is drawn from an insufficient or inadequate sample of evidence, which leads to an overly broad or inaccurate generalization.

in this case, the statement implies that all new foods introduced are unhealthy every week, without providing any concrete evidence or considering the vast variety of new foods being introduced. this type of generalization is hasty because it does not take into account the numerous new food products that could be healthy and nutritious, resulting in an oversimplification of the situation.",False
489,TITLE: There are now traffic cameras that can spot you using your phone while driving POST:,nothing,"rephrased question: in view of the offered list of logical errors, could you ascertain which fallacy is present in the given statement? please examine the excerpt and furnish an extensive rationale for your selected fallacy.

segment:
title: new traffic cameras can detect if you're using your phone while driving
post: 

response template:
the presented argument exhibits the fallacy of [fallacy name]. this fallacy transpires when [condensed explanation of the detected fallacy]",False
490,Distracted driving is a HUGE problem but the fact that people are begging for a state run mass surveillance system is terrifying.,slippery slope,"rephrased question:
could you analyze the given text for any occurrences of logical fallacies and specify the particular fallacy present, along with a brief explanation of how it appears in the content?

segment: distracted driving is a huge problem but the fact that people are begging for a state run mass surveillance system is terrifying.

response template:
the text exhibits the slippery slope fallacy. this fallacy arises when an argument implies that a small action or decision will result in severe and often unfounded consequences, without providing solid evidence. here, it suggests that advocating for a state-run mass surveillance system to address distracted driving is a slippery slope towards frightening outcomes.",True
491,It may seem innocuous and even helpful at first but the implications are tremendous.,slippery slope,"the provided segment appears to exhibit an example of the slippery slope fallacy. this fallacy emerges when a relatively small action or occurrence is claimed to result in significant, frequently overstated outcomes without adequate proof or logical continuity.",True
492,These are the first steps towards mass facial recognition and social credit systems...,slippery slope,"the segment does not contain any specific fallacies. however, it seems to be a statement about potential advancements in technology and their implications.",False
493,and people are clamoring for it.,slippery slope,"the provided argument segment seems to be missing key information or context. please provide a complete argument segment in order for me to identify and analyze the type of logical error or fallacy present, and how it aligns with the definitions and characteristics of the listed fallacies.",False
494,Its crazy.,nothing,"the provided segment ""its crazy"" does not seem to include any logical reasoning or argumentation. it appears to be an emotional expression rather than a logical statement. as a result, it is difficult to identify a specific fallacy within this context. please provide a more detailed argument for analysis.",False
495,The Cardinals are the best football team because they're better than all the other teams.,circular reasoning,"rephrased question:
given the different types of logical fallacies and their explanations, which fallacy can be identified in the statement ""the cardinals are the best football team because they're better than all the other teams""?

response template:
this statement exhibits a [fallacy name] by claiming that the cardinals are the best football team based on their superiority over all other teams. this fallacy is defined by [a brief description of the specific fallacy].",False
496,They're better than all the other teams because they're the best.,circular reasoning,"rephrased question:
based on the characteristics of fallacies listed, which fallacy can be identified in the provided segment, and how does it manifest within its context?

**segment:** they're better than all the other teams because they're the best.

#### response template:
the segment exemplifies a [fallacy name] fallacy. this type of fallacy arises when [brief description of the identified fallacy]. in this instance, the fallacy is present in the assertion that a team is superior to all others simply due to being labeled as ""the best."" the argument relies on overgeneralization, implying that being deemed the best inherently makes them better than the rest.",False
