Unnamed: 0,text,expected_label,actual_label,result,canonical
187,"or as my sister called it,""laundry over dirt field""  Well it's common in Sichuan where this dish is originated from to serve it like this, so it's not a stupid restaurant plating thing it's how it should be
",nothing,"answer: appeal to tradition

explanation: the person justifies their position by claiming that the way the dish is served in its country of origin makes it correct, even if others might find it unusual. however, this does not provide any evidence or reason to support the claim that the dish should be served in such a manner. therefore, it is a fallacy where someone uses historical preferences of the people (tradition), either in general or as specific as the historical preferences of a single individual, as evidence that the historical preference is correct.",False,appeal to tradition
188,all believe I would make a stronger commander in chief. And they believe it because they know I would not take my eye off of the goal: Osama bin Laden.,appeal to (false) authority,answer: no fallacy,False,nothing
189,"Fred, the German, stole my wallet. Therefore, all Germans are thieves.",hasty generalization,answer: generalization,False,hasty generalization
190,"Slavery is accepted by just about everyone in our society, so it's ethical to keep slaves.",ad populum,answer: appeal to popularity,False,ad populum
191,"EDIT: The good news is they will be cheap, the bad news is you need someone who can do smd soldering, which, for no good reason, is a dark art.",nothing,answer: appeal to emotion,False,appeal to emotion (level 1)
192,"
 I just picked up one of the tinted balms and it's a really lovely product.",nothing,answer: nothing,True,nothing
193,Have you not know that this poster is extremely popular in Oculus sub reddit?,ad populum,answer: nothing,False,nothing
194,"Thank you, have a nice day
 Enter Bios and see if your hdd is detected.",nothing,answer: appeal to emotion,False,appeal to emotion (level 1)
195," New Firefox Update
 Dog software on cat hardware
 Wouldn't it be the other way around?",nothing,answer: nothing,True,nothing
196,"Most people I spoke to didn't like TLJ, so if anything, it should have a lower than 55% score.",hasty generalization,answer: nothing,False,nothing
197," Legion is the best overall expac we will ever get and here is why
 This feels like definite nostalgia talking to me.",nothing,answer: appeal to nostalgia,False,no match
198,"I don't know, it's just a thing with me because I've been helping orphans for a long time and their mental health is seriously fucked up because of it.",nothing,answer: appeal to emotion,False,appeal to emotion (level 1)
199,"
 I got those tests and they came back fine, I was so confident that it was lupus for a while but that negative test has really thrown me !",nothing,answer: nothing,True,nothing
200,"
 So a woman got in an altercation, got mad and grabbed a gun and starting shooting, and was then shot by someone else.",nothing,"the example provided does not describe a fallacy. it is simply describing the sequence of events that took place during an altercation. a fallacy would be a flawed or misleading form of reasoning in an argument, which is not present in this scenario. therefore, the answer is:

answer: nothing",True,no match
201,"
 I get that it's weird that someone from the lgbtq+community supports fascists who want people like him to die, but I don't see his sexual identity having any relevance to this story.",nothing,answer: appeal to stereotype,False,no match
202," Ned, the actor behind Micheal, was recently admitted in the hospital for Covid Pneumonia, hoping for his good health and be well soon
 First we nearly lost Dr. Dre now we might lose Michael.",nothing,answer: nothing,True,nothing
203,"
 many people have been calling out science subreddit mods like mvea etc for spamming ""shill articles"" etc.",nothing,answer: nothing,True,nothing
204,"
 Oh man, I'm actually relieved, because I had to do this same shit to my subordinates, and honestly I made up numbers 99% of the time because they worked their full hours and could prove it, and their performance was the best in the office because they weren't being crushed by an asshole dictator.",nothing,answer: appeal to pity,False,appeal to pity
205,Female sexual history obviously plays a big role in the success of marriage.,false causality,answer: appeal to stereotype,False,no match
206,With the amount of weapons in the USA and the ease of smuggling in the country assault weapon bans wouldn't do anything because you could still get then illegally.,false causality,answer: nothing,False,nothing
207,Restrictions on acquisitions are not going to stop that. Enforcement of possession laws will stop that and no politician is campaigning to do that.,false dilemma,answer: nothing,False,nothing
208,"The NRA commits terror by encouraging circumstances and laws which lead to 30,000 deaths a year",appeal to anger,answer: nothing,False,nothing
209,"Young people who do not vote should be shamed. What can we do to get more young people involved? The barriers today are much less than any other time in history, eg women and people of color segregation and disenfranchisement",causal oversimplification,answer: fallacy of relative privation,False,no match
210,"Lars, Kirk and even Cliff have all been criticized for their technical skills, but their creativity, along with James (who is an excellent songwriter and rhythm guitarist), was what made Metallica the greatest metal band of all time, not their chops.",causal oversimplification,answer: nothing,False,nothing
211,Every one I remember seeing has proven itself to be between 50% and 90% overstated. Our death counts ended up being 10% of what the models were forecasting.,hasty generalization,answer: nothing,False,nothing
212,They claim they don't have the personnel to staff them....despite the state's NG being given authorization from our governor to send its stock of nurses and doctors to do it.,causal oversimplification,answer: appeal to fear,False,appeal to fear
213,It makes me wonder of it was just the usual bureaucratic waste or if they've got a future use in mind for the facility...,false dilemma,answer: appeal to suspicion,False,no match
214,You havent played but are talking about it like this? Oof,tu quoque,answer: appeal to authority,False,appeal to (false) authority
215,"Imagine being a horny naive 16 year old. You were talking to a girl, you guys exchange nudes. You're 21. It's been revealed to other adults that you sent a picture of your dick (nice cock btw). You're on the sex offender registry. You will get almost all job offers turned down. Your life is fucked because someone decided your life should be shit for being a horny teenager.",Appeal to Ridicule,answer: nothing,False,nothing
216,21 year old aren't teenagers,straw man,answer: nothing,False,nothing
217,"If this was just people getting details mixed up, the Mandela Effect would not sustain the interest it has.",ad populum,answer: nothing,False,nothing
218,"a lot of leftists are mad that its 1400 checks not 2000, because it was meant to supplement the 600 passed in december",causal oversimplification,answer: nothing,False,nothing
219,If Kavanaugh is innocent he should be yelling from the hills demanding an investigation by the FBI.,causal oversimplification,answer: nothing,False,nothing
220,"If Dr. Ford *is* lying, then Republicans should be *eager* to get her in front of an FBI interrogator.",causal oversimplification,answer: nothing,False,nothing
221,The government has no right to spilt up your business,appeal to fear,answer: nothing,False,nothing
222,"But every time I bring this point up, GOP_Fanboy just reverts to ""lol who are you to decide who gets paid what communist etc""",Appeal to Ridicule,answer: ad hominem,False,ad hominem
