Unnamed: 0,text,expected_label,actual_label,result,canonical
91,"Social media is the worst. People don't realize how much of an effect it has on someone, especially his generation.",hasty generalization,answer: appeal to emotion,False,appeal to emotion (level 1)
92,Anyone in the public eye who has any sort of mental health issue should rid themselves of their accounts if they possibly can.,false dilemma,answer: nothing,False,nothing
93,"China has people in internment camps and people in the middle east get stoned for not wearing head scarves, but it's social media that's the worst?",appeal to worse problems,answer: nothing,False,nothing
94,"Mr. Gough supports the cell phone ban and he's an idiot, so we should let teachers keep their cell phones.",ad hominem,answer: ad hominem,True,ad hominem
95,"Bill, you drive a beat-up car from the 1980s. For this reason, we can never allow you to be a lifeguard at the community pool.",ad hominem,answer: nothing,False,nothing
96,The teenagers where rude and disrespectful therefore all teenagers are rude and disrespectful.,hasty generalization,answer: hasty generalization,True,hasty generalization
97,"If you give the government *any* control over what is considered""hate speech"", you are basically relinquishing your freedom of speech. It's a slippery slope. For example: saying""hateful"" things about Islam becomes illegal. Let's say you criticise Sharia laws (laws based off of the rules set out in Islam for those who are unaware). Next thing you know, your own government has full power to censor this""hate"", and you are persecuted simply for disagreeing with the laws of an ally nation. Governments have shown time and time again that they are more than happy to censor and abuse their peoples. Don't ever relinquish your freedoms willingly.",appeal to fear,answer: slippery slope,False,slippery slope
98,Governments have shown time and time again that they are more than happy to censor and abuse their peoples.,hasty generalization,answer: nothing,False,nothing
99,That means it must be really good!,ad populum,"answer: nothing. the given statement is not a fallacy, it's just a description of a hypothetical situation in which experts are trying to come to an agreement through discussion and reevaluation of their beliefs. the statement does not make any logical error or misrepresent the argument, but rather presents a scenario of how experts might try to reach consensus.",False,ad populum
99,That means it must be really good!,ad populum,"answer: nothing. the given statement is not a fallacy, it's just a description of a hypothetical situation in which experts are trying to come to an agreement through discussion and reevaluation of their beliefs. the statement does not make any logical error or misrepresent the argument, but rather presents a scenario of how experts might try to reach consensus.",False,nothing
100,"If we ban Hummers because they are bad for the environment, then eventually the government will ban all cars; therefore, we should not ban Hummers.""",slippery slope,answer: false dilemma,False,false dilemma
101,"My roommate from Maine loves lobsters, therefore all people from Maine love lobsters.",hasty generalization,answer: generalization,False,hasty generalization
102,I worked in an engineering factory for years and was never supplied a back belt so I now have a bad back and the only way I can get any sleep is to take 4 pain killers before bed or smoke one joint so I'll stick to what's natural rather than use so many painkillers my liver will be useless in a few years so cannabis for the win with me,appeal to nature,answer: false dilemma,False,false dilemma
103,There must be a firm basis to people hating Islam. There are many of us and we can't all be wrong.,ad populum,answer: ad populum (appeal to popularity),True,ad populum
104,"You are damn right i am and with good reason. With my own two eyes i have seen how it destroys countries, Islamic countries none the less.",false causality,answer: appeal to fear,False,appeal to fear
105,People that support this religion blowing each other up.,appeal to fear,answer: nothing,False,nothing
106,"You are doing a dis-service to your country being""politically correct"" in regard to Islam and your children will suffer because of it.",appeal to fear,answer: appeal to fear,True,appeal to fear
107,Good thing CA is able to focus on this hugely important issue and doesn't have massive homelessness plaguing it's cities or an ever increasing affordable housing crisis to worry about.,appeal to worse problems,"answer: appeal to poverty

the statement seems to be suggesting that because california has other problems, it can't focus on this particular issue. this is a fallacy of distraction where the arguer tries to distract from the truth of the conclusion by pointing out unrelated issues.",False,no match
108,I'm so glad CA is at the forefront of tackling our nation's most pressing issues. Keep being a beacon of hope CA and I'm sure other states will follow.,Appeal to Ridicule,answer: appeal to hope,False,no match
109,The policies of the last eight years and -- and Washington's unwillingness to tackle the tough problems for decades has left us in the worst economic crisis since the Great Depression.,causal oversimplification,answer: no,False,no match
110,And that's why the biggest risk we could take right now is to adopt the same failed policies and the same failed politics that we've seen over the last eight years and somehow expect a different result.,appeal to fear,answer: circular reasoning,False,circular reasoning
111,"Ive collectively had sex hundreds of times with my partners over the years, that doesn't make me better than someone who's had sex with more people, one time each.",false analogy,answer: nothing,False,nothing
112,Almost everyone in the world will look more favorably on a person who has had sex 100x times with one person versus having sex 1x each with 100 different people.,ad populum,answer: nothing,False,nothing
113,I work 6 ten hour days very frequently and don't get weekends off. In a way it's pretty insulting to see people angry with a 9-5 40 hour work week. I'd be so grateful to have that extra time to spend with my family and friends.,appeal to pity,answer: nothing,False,nothing
114,A few students are misbehaving...therefore the whole class is bad.,hasty generalization,answer: hasty generalization,True,hasty generalization
115,It implies an existing framework of what the extremes of diet are or can be.,straw man,it implies an existing framework of what the extremes of diet are or can be.,False,no match
116,"For example, if we're speaking'natural' diet. Balance can't include any refined sugar at all because we weren't able to process it. Before the food pyramid came around the upper end of sugar consumption would have been much lower.",straw man,"answer: appeal to nature

explanation: the argument seems to be appealing to ""natural"" as if what is natural is inherently good or correct, rather than looking at evidence for the health effects of refined sugar. therefore, it is a fallacy where a person believes something is true because it's natural, instead of looking at the facts and scientific evidence.

step 1: the speaker claims that balance can't include any refined sugar at all because we weren't able to process it before the food pyramid came around.
step 2: the speaker suggests that historical context should inform our modern understanding of what constitutes a balanced diet.
step 3: the speaker assumes that pre-food pyramid diets were inherently healthier, which may not be true for various reasons (e.g., shorter life expectancy, different environmental factors, etc.).
step 4: the speaker uses the appeal to nature fallacy by assuming that something is true because it's natural, instead of looking at evidence-based facts.

answer: appeal to nature",False,appeal to nature
117,But irrespective of whether he thinks it is or not means less than fact that this country cannot morally and socially and economically accept an economy running out the clock on the 20th Century.,appeal to fear,answer: fallacy of the complex question,False,no match
118,We're treading water. We have families that are hurting. We have people who are unemployed. We have people with no property. We have an administration that is demolishing public housing in our inner cities and not providing anything else but more public housing.,appeal to anger,answer: nothing,False,nothing
119,"Their solution to the inner city is more -- excuse the expression but it's true,""socialism.""",false dilemma,answer: no response,False,no match
120,"Michael Jackson, Kurt Cobain, and Jimi Hendrix were rock stars who died young. Therefore, if you become a rock star, don't expect to live a long life.",hasty generalization,answer: hasty generalization,True,hasty generalization
121,Over 5 million Filipinos use our products. It's time to switch to our brand now!,ad populum,answer: appeal to popularity,False,ad populum
122,"I think I'm right because I believe that we must have a consistent foreign policy, a strong America, and a strong economy.",appeal to positive emotion,answer: nothing,False,nothing
123,it's clear enough so that there are 2.18 billion Christians,ad populum,answer: appeal to popularity,False,ad populum
124,"And the budget plan that I've put out, according to the""Los Angeles Times"" again, the way these things are typically measured as a percentage of the GDP, will bring government spending down to the lowest level in 50 years. So I want to proceed carefully to cover more people.",appeal to (false) authority,"answer: appeal to authority

explanation: the statement is making a claim about the effectiveness of the budget plan, but it is providing evidence by citing an authority (""the los angeles times"") rather than providing direct evidence or reason for the claim. therefore, it is a fallacy where an argument is made more persuasive by attributing it to an authority figure or source, without considering whether the information itself is valid and well-reasoned.",False,appeal to (false) authority
125,"Animals aren't food for us. If you wouldn't eat a dog or cat, don't eat a cow or chicken. Even if you would eat a dog or cat, don't.",false analogy,answer: false analogy,True,false analogy
126,"Animals are food for other animals, why they wouldn't be food for humans?",appeal to nature,"answer: false analogy

explanation: the statement is attempting to draw a parallel between the consumption of animals by non-human predators and the consumption of animals by humans. however, the reasoning fails to consider the difference in moral, ethical, social, and legal aspects that differentiate the two scenarios. therefore, it is a fallacy where an invalid analogy is drawn based on insufficient similarities between two situations.",False,false analogy
127,The president of Honduras is a good leader because he is a leader of the country.,circular reasoning,answer: fallacy of affirming the consequent,False,no match
128,"The government's bigger than it was when President Kennedy was around, even though he says it's not.",nothing,answer: appeal to authority,False,appeal to (false) authority
129,Families communicate less and less in the past forty years since feminism became mainstream. Feminism is to blame for this deterioration in the family.,false causality,answer: post hoc fallacy,False,false causality
130,"Our military is the strongest military in the world. It is the strongest, best prepared, best equipped it has ever been.",appeal to positive emotion,answer: appeal to authority,False,appeal to (false) authority
131,"Murder is morally wrong. Therefore, abortion is morally wrong.",false analogy,answer: false analogy,True,false analogy
132,"Violent video games cause teens to be violent, because violent teens play violent video games.",circular reasoning,answer: post hoc fallacy,False,false causality
133,"These test results are clearly wrong, and it must be either because the client was malingering or because I bungled the test administration.",false dilemma,answer: appeal to two mutually exclusive causes fallacy (also known as false dilemma),True,false dilemma
134,Is that why my prescriptions and premiums keep going up massively?,Appeal to Ridicule,answer: nothing,False,nothing
135,"Trump hasn't done shit to improve healthcare, he has done the complete opposite.",appeal to anger,answer: nothing,False,nothing
136,I did it because I worked my ass off and learned a skill in the military. It's not that hard you just got to do the best you can.,causal oversimplification,answer: nothing,False,nothing
137,"Or put another way If you run into an asshole in the morning, you ran into an asshole.",nothing,answer: nothing,True,nothing
138,For want of a nail the shoe was lost. For want of a shoe the horse was lost. For want of a horse the rider was lost. For want of a rider the battle was lost. For want of a battle the kingdom was lost.,slippery slope,"answer: chain reaction fallacy

explanation: the statement uses a chain reaction to draw a conclusion, assuming that if one event did not occur, then a series of subsequent events would not occur either. this is an oversimplification and does not take into account the complexity of real-world situations or the possibility of other factors influencing the outcome. therefore, it is a fallacy where it assumes a direct, linear connection between events without considering that other factors could have influenced the outcome.
answer: chain reaction fallacy",False,no match
139,"I bought a ticket to win a new car at the mall, since I have never won anything like that in the past.",false causality,answer: post hoc fallacy,False,false causality
140,"I went veg because factory farming is horribly unnatural, but I can't really come up with an argument against hunting based on what made me go veg...",appeal to nature,answer: nothing,False,nothing
141,"I'm vegan, I'll never part take in this activity, but I don't feel like hunting for fun should be considered a mental illness. Our ancestors used to depend on it to survive, so I can see how it might be in someone's genome to want to hunt.",appeal to tradition,answer: nothing,False,nothing
142,"Our ancestors used to depend on it to survive, so I can see how it might be in someone's genome to want to hunt. Hunting is almost entirely aligned with the natural cycle of life, factory farming in horrible conditions isn't.",appeal to nature,answer: appeal to nature,True,appeal to nature
143,Cooking and eating meat is an artistic practice with thousands of years of history. My choice to cook and eat meat is a choice to participate in the continuation of this art form.,appeal to tradition,answer: nothing,False,nothing
144,"I support eating meat for the same reason I would support classical music, theater, or sculpture: because I support art.",false analogy,"answer: appeal to authority (in this case, ""art"")",False,appeal to (false) authority
145,"He was right, but then he put in place deficits twice that size for every one of his four years.",tu quoque,"answer: fallacy of composition

in this statement, the person is committing a fallacy of composition. the fallacy of composition occurs when someone concludes that something true about parts or individuals must also be true about the whole or group. in this case, the argument suggests that since ""he was right"", it must therefore be correct for him to put in place larger deficits for each year of his term. however, being right about one thing does not necessarily mean that doing something else on a larger scale will also be correct.",False,no match
146,14 year olds are plenty old enough to be around loaded guns. They arent 4. I had guns in a safe in my bedroom from 10 years old. I had the key and ammo.,hasty generalization,answer: appeal to anecdote,False,no match
147,"Yeah its not just about my approval, pretty sure the majority of people in the U.S are against open carrying an AR. No one sees someone carrying a long gun in public and thinks wow look at them go, so glad they are exercising their rights.",ad populum,answer: nothing,False,nothing
148,"No one sees someone carrying a long gun in public and thinks wow look at them go, so glad they are exercising their rights. Theyre thinking Im glad I have my ccw so I can drop this motherfucker if he sneezes. And youre right, I should just assume that all 14 year olds were taught properly on how to handle firearms even if their parents are pieces of shit. I shouldnt care if he hurts himself or someone else because if I did Id just be infringing in someones rights. Glad your parents believed you wouldnt kill someone with a gun that young. Too bad other parents believed the same thing.",Appeal to Ridicule,answer: nothing,False,nothing
149,There is nothing wrong with being racist or anti Semitic. Being tribal is a normal part of being human.,appeal to nature,answer: non sequitur,False,no match
150,Almost 3k upvotes show that most people agree with me.,ad populum,answer: nothing,False,nothing
151,"Its weird, its not socially or mentally healthy, its not a thing.",ad hominem,answer: nothing,False,nothing
152,Even the Republican platform has criticized the lack of leadership in Mr. Ford and they've criticized the foreign policy of this administration.,appeal to (false) authority,answer: appeal to authority,False,appeal to (false) authority
153,"This is one instance where I agree with - with the Republican platform. I might say this in closing, and that is that as far as foreign policy goes, Mr. Kissinger has been the president of this country.",ad hominem,answer: appeal to authority,False,appeal to (false) authority
154,he thinks he's just hanging out with a buddy but what he fails to realize is that he has a huge platform with a fan base of highly impressionable young men who feel wronged by society and entitled to scream like a monkey on the back of a pig with a cowboy hat,hasty generalization,answer: nothing,False,nothing
155,Free speech bad,Appeal to Ridicule,answer: nothing,False,nothing
156,"Mrs. Miller taught your older brother, who was the class clown. She decides to be strict with you from the very first day of class because she thinks you will be a clown, too.",guilt by association,answer: appeal to stereotype,False,no match
157,"Mankind has been using""recreational drugs"" since we developed agriculture, and probably before too.",appeal to tradition,answer: nothing,False,nothing
158,"James' mom is concerned when she finds out that he skipped class one day. She tells him that she is concerned that since he skipped one class, he will start skipping more frequently. Then he will drop out altogether, never graduate or get into college, and end up unemployed and living at home for the rest of his life.",slippery slope,answer: nothing,False,nothing
159,So the least corrupt state is anarchy by this logic.,Appeal to Ridicule,answer: fallacy of composition,False,no match
160,"This is""deep"" libertarian bullshit.",ad hominem,answer: ad hominem,True,ad hominem
161,"Good people don't need laws to tell them how to be good, bad people either ignore laws or use/create them to hide behind...",circular reasoning,answer: nothing.,False,nothing
162,"Well if 10 minutes isnt bad, then surely 11 is ok. If 11 is ok then 13 is fine. If 13 is fine then whats wrong with 15. You said 15 is ok, 16 is just a minute more. Were at 16, Im finishing up and will be checked out by 18. See how it keeps getting stretched out?????",slippery slope,answer: nothing,False,nothing
163,When the goddamned sign says the store closes at 9:00 the fucking customers need to get the fuck out by 8:59. They had all day to get their shit taken care of.,causal oversimplification,answer: nothing,False,nothing
164,When the goddamned sign says the store closes at 9:00 the fucking customers need to get the fuck out by 8:59. They had all day to get their shit taken care of. At 9 0 0 youre on my time.,appeal to anger,answer: nothing,False,nothing
165,Three congressional representatives have had affairs. Members of Congress are adulterers.,hasty generalization,answer: appeal to unrepresentative sample,False,hasty generalization
166,So he's saying liberals are better educated than conservatives. We agree. Trump isn't the only one who loves the poorly educated.,Appeal to Ridicule,answer: nothing,False,nothing
167,"Or, more accurately, many liberal professors abuse their positions by attempting to force their political opinions into subjects they don't belong in, like the English professor who insists their students each write a paper on""Why the GOP are terrorists"" and grade students poorly who disagree with that opinion (experienced that first hand).",hasty generalization,"answer: appeal to authority

explanation: the statement is an anecdotal claim without any evidence to back it up, so it relies on the speaker's personal experience as if that should be enough proof for others. however, personal experiences are not always reliable sources of information, especially when they lack proper context and other supporting evidence. therefore, it is a fallacy where anecdotal claims without evidence are used to support a generalization about all people or situations.",False,appeal to (false) authority
168,"Many of the big name institutions have become incestuous single minded orgies which no longer challenge students to think out of the box, challenge assumed truths and seek to learn all they can, but instead have become factories to produce a very specific set of opinions and mindsets never to be questioned.",ad hominem,answer: nothing,False,nothing
169,Incoming comments of things that are nutritious but people don't consider healthy because they're high in calories AND other random shit they read on a blog who's ultimate goal is to convince them to spend money on something at some point.,Appeal to Ridicule,answer: nothing,False,nothing
170,Dairy and red meat are fine - people have been consuming them for centuries and they did shit like building pyramids using just their hands.,appeal to tradition,answer: fallacy of anecdotal evidence,False,no match
171,"You don't need to live off of bland chicken breasts, broccoli, and scrambled eggs to be healthy.",straw man,answer: nothing,False,nothing
172,I think one of the biggest reasons for the obesity epidemic in America is the over-complication of nutrition.,causal oversimplification,answer: nothing,False,nothing
173,"I think one of the biggest reasons for the obesity epidemic in America is the over-complication of nutrition. A new food is""unhealthy"" every week.",Appeal to Ridicule,answer: n/a,False,nothing
174,Distracted driving is a HUGE problem but the fact that people are begging for a state run mass surveillance system is terrifying. It may seem innocuous and even helpful at first but the implications are tremendous. These are the first steps towards mass facial recognition and social credit systems... and people are clamoring for it.,appeal to fear,answer: appeal to fear,True,appeal to fear
175,The Cardinals are the best football team because they're better than all the other teams. They're better than all the other teams because they're the best.,circular reasoning,answer: circular reasoning,True,circular reasoning
176,But did they check slow food? Dollars to donuts that eating at an average restaurant is unhealthier than 30 years ago by an even wider margin.,appeal to worse problems,answer: nothing,False,nothing
177,Fast food isn't fueling the obesity epidemic; FOOD is fueling the obesity epidemic.,causal oversimplification,answer: nothing,False,nothing
178,Let's not forget Genetically Modified foods. They are not on our food chain.,appeal to nature,answer: nothing,False,nothing
179,"Yeah, I always go to religious organizations to supply me with clear and objective scientific studies...",Appeal to Ridicule,"answer: appeal to authority

the person making this statement is implying that religious organizations are a source of reliable scientific information, which is false. this is a fallacy where an argument is incorrectly presented as valid because the source presenting it is assumed to be authoritative on the subject matter, when in reality they may not be.",False,appeal to (false) authority
180,"But as Admiral Yarnell has said, and he's been supported by most military authority, these islands that we're now talking about are not worth the bones of a single American soldier; and I know how difficult it is to sustain troops close to the shore under artillery bombardment.",appeal to (false) authority,answer: appeal to authority,False,appeal to (false) authority
181,"I propose that for a modern account of a miracle, if the person telling you the account is trustworthy, that is a reason to take the account seriously.",appeal to (false) authority,answer: appeal to authority,False,appeal to (false) authority
182,He has smoked cigarettes his entire life and he doesn't have lung cancer. Therefore smoking doesn't cause lung cancer.,hasty generalization,answer: fallacy of insufficient sample size,False,no match
183,"It causes economic problems and turmoil, and then we turn around, as we did in Mexico, having to bail them out.",causal oversimplification,answer: appeal to fear,False,appeal to fear
184,"Yeah, this doctor is a moron. Not smart like you.",Appeal to Ridicule,answer: ad hominem,False,ad hominem
185,But you don't have a lot of experience in project management either!,tu quoque,answer: ad hominem,False,ad hominem
186,"Rightly so. I don't care how it makes trans people feel, the vast majority of people would want to know if someone was born a different sex to that which they're passing themselves off as.",ad populum,answer: appeal to majority,False,ad populum
