Unnamed: 0,text,expected_label,actual_label,result,canonical
0,"I keep seeing if an adventure mode needs to exist then why not just start a char at 68. then a couple months after that we'll see post about how people want to start at 90 just so they can kill bosses. Then a few months later we'll see people asking for a""creative"" mode so they can have access to all items in the game so they don't have to farm, and i dont think that sets a good example as a community for a game that we all love.",slippery slope,answer: nothing,False,nothing
1,That leads to me believe that most cat lovers are really shy.,hasty generalization,answer: hasty generalization,True,hasty generalization
2,"Someone once told me they have an""alt"" cause their main account was too high of rank to play with their friends. It's exactly the same as smurfing.",false analogy,answer: nothing,False,nothing
3,Joe Biden will lose to Trump if he is the nominee. The Democratic party clearly has not learned the right lesson from Hillary Clinton's miserable failure.,guilt by association,"answer: appeal to authority (referring to hillary clinton's experience as a ""miserable failure"")",False,appeal to (false) authority
4,Joe Biden will lose to Trump if he is the nominee. The Democratic party clearly has not learned the right lesson from Hillary Clinton's miserable failure. NOBODY WANTS ESTABLISHMENT POLITICIANS ANYMORE. NOBODY LIKES THE STATUS QUO.,causal oversimplification,answer: appeal to fear,False,appeal to fear
5,The Democratic party clearly has not learned the right lesson from Hillary Clinton's miserable failure. NOBODY WANTS ESTABLISHMENT POLITICIANS ANYMORE. NOBODY LIKES THE STATUS QUO.,ad populum,"answer: appeal to majority

step 1: the statement makes a claim about what the majority of people want or don't want, implying that it is a fact. however, this is an assumption and not based on actual evidence or data. this can be considered as a form of logical fallacy known as an ""appeal to majority"" or ""bandwagon fallacy.""

step 2: the bandwagon fallacy occurs when someone tries to persuade others by appealing to the popular opinion, implying that if many people believe something, it must be true. however, this is not always the case as popularity does not guarantee truth or validity.",False,ad populum
6,The status quo in America is that its the best its ever been. We live in one of the best societies in the best times that humans have ever experienced.,circular reasoning,answer: nothing,False,nothing
7,"America is the best place to live, because it's better than any other country.",circular reasoning,answer: nothing,False,nothing
8,"Let us move now to the future. It is not enough to stand on this record because we are dealing with the most ruthless, fanatical... leaders that the world has ever seen.",appeal to fear,answer: nothing,False,nothing
9,"That is why I say that in this period of the sixties, America must move forward in every area.",causal oversimplification,answer: no response provided,False,no match
10,Delores is a big supporter for equal pay for equal work. This is the same policy that all those extreme feminist groups support. Extremists like Delores should not be taken seriously -- at least politically.,ad hominem,answer: ad hominem,True,ad hominem
11,"""Four out of five dentists recommend Happy Glossy toothpaste. Therefore, it must be great.""",appeal to (false) authority,"answer: appeal to authority

explanation: the statement is making an argument based on the recommendation from a majority of the dentists surveyed, which implies that these experts have determined that happy glossy toothpaste is better than other options. this fallacy occurs when one appeals to a person or people who are assumed to be reliable or qualified, but their actual credibility in relation to the argument at hand has not been proven or verified. in this case, it's not clear whether these dentists have any particular expertise or experience with happy glossy toothpaste. therefore, it is a fallacy where an alleged authority is used as evidence in your argument when the authority is not really an authority on the facts relevant to the argument.
answer: appeal to authority",False,appeal to (false) authority
12,Once they wear masks your anxiety will force you to demand the next step. biohazard suits? get real.,slippery slope,answer: fallacious reasoning,False,no match
13,"The last Democrat winner of the New Hampshire primary won the general election. This year, the winner of the New Hampshire primary will win the general election.",causal oversimplification,"answer: inductive reasoning fallacy (post hoc ergo propter hoc)

explanation: the statement seems to use a pattern or correlation to make an assumption about causality. just because in the past the last democrat winner of new hampshire primary has won the general election, it does not necessarily mean that this will be the case for the current year's election. there could be many other factors at play in an election, including changes in voter sentiment, demographics, and political environment, among others. therefore, it is a fallacy where the assumption of causality is made based on mere correlation or sequence (post hoc ergo propter hoc), rather than a demonstrable cause-and-effect relationship.",False,false causality
14,"Men score better on math than women do. Jerry is a man. Therefore, Jerry is better at math than Sylvia, who is a woman.",fallacy of division,answer: appeal to stereotype,False,no match
15,So much important stuff in the world that needs political activism. Makes a petition to portbeg P5 onto PC and Switch.,Appeal to Ridicule,answer: nothing,False,nothing
16,Carbon dioxide hurts nobody' s health. It' s good for plants.,false analogy,answer: false dilemma,False,false dilemma
17,Carbon dioxide hurts nobody' s health. It' s good for plants. Climate change need not endanger anyone.,causal oversimplification,answer: nothing,False,nothing
18,"Mr. Governor issues a proclamation for the people of his state to pray for rain. Several months later, it rains. Praise the gods!",Appeal to Ridicule,answer: appeal to superstition,False,no match
19,"Iran has moved forward with its nuclear weapons program. They're more dangerous today than they were four years ago. North Korea has moved forward with their nuclear weapons program, gone from one to two nuclear weapons to six to eight nuclear weapons. This vice president has been an advocate for over a decade for lifting sanctions against Iran, the largest state sponsor of terrorism on the planet. It's a mistake.",appeal to fear,answer: nothing,False,nothing
20,"North Korea has moved forward with their nuclear weapons program, gone from one to two nuclear weapons to six to eight nuclear weapons. This vice president has been an advocate for over a decade for lifting sanctions against Iran, the largest state sponsor of terrorism on the planet. It's a mistake.",false analogy,answer: nothing,False,nothing
21,"This vice president has been an advocate for over a decade for lifting sanctions against Iran, the largest state sponsor of terrorism on the planet. It's a mistake.",guilt by association,answer: nothing,False,nothing
22,You cant stop nature. Youre going to be infected if you havent already. We are always trying to fight nature. We just have to let it run its course.,appeal to nature,answer: fallacy of naturalistic fallacy,False,no match
23,"The majority of the class says they prefer grape flavored drinks, so Jeff tells his superiors that grape is the flavor favored most by high school students.",hasty generalization,answer: appeal to majority,False,ad populum
24,The Freehold Raceway Mall is the best mall because there are always so many cars there.,causal oversimplification,answer: appeal to popularity,False,ad populum
25,This is law school arrogance at its finest. Why not a brain surgeon?,Appeal to Ridicule,answer: nothing,False,nothing
26,"Along the Russian coastline, which makes up more than half the Arctic total, winds and currents push old ice away from potential shipping lanes and prevent the build-up of thicker, multi-year ice that would leave other parts of the Arctic impassable for longer periods.",nothing,answer: nothing,True,nothing
27,"My first day of basketball practice was easy, so it will always be easy.",false causality,answer: fallacy of composition,False,no match
28,Don't listen to him! He's a terrible person! I saw him trip another student and steal his lunch money!,ad hominem,answer: ad hominem,True,ad hominem
29,"The left is asking for expanding background checks, closing the gun show loop hole, maybe registering firearms and creating a system that addresses or catches strawman purchases.",nothing,"the statement you provided does not contain any fallacy in its wording itself, so it's 'answer: nothing'. however, if we look at the broader context of the statement, one might argue that there is an implicit appeal to fear by implying that without these measures, something bad will happen. but this would be a stretch and more of a critique rather than identifying a clear fallacy in the text provided.",True,appeal to fear
29,"The left is asking for expanding background checks, closing the gun show loop hole, maybe registering firearms and creating a system that addresses or catches strawman purchases.",nothing,"the statement you provided does not contain any fallacy in its wording itself, so it's 'answer: nothing'. however, if we look at the broader context of the statement, one might argue that there is an implicit appeal to fear by implying that without these measures, something bad will happen. but this would be a stretch and more of a critique rather than identifying a clear fallacy in the text provided.",True,nothing
30,"Several years ago, a group of 10 psychologists started a psychology training program. Each of those psychologists is efficient, effective, and highly-regarded. Their training program must be efficient, effective, and highly-regarded.",causal oversimplification,"answer: fallacy of composition

reasoning: the argument assumes that the efficiency, effectiveness, and high regard of each individual psychologist directly translates to the entire group or their joint project (the training program). this is a logical fallacy because the characteristics of the individuals do not necessarily apply to the group as a whole.",False,no match
31,"efficient, effective, and highly-regarded. Their training program must be efficient, effective, and highly-regarded.",false analogy,answer: fallacy of composition,False,no match
32,"I lost my phone in the living room, so it will always be in the living room when it is lost.",false causality,answer: affirming the consequent,False,no match
33,"So was the bar burned by a mob and the owner killed? If not, Christians have a ways to go before they are on par with Muslims.",false dilemma,answer: nothing,False,nothing
34,"If you sell at bottom, you're either panicking or trying to crash the price of the asset you're selling.",false dilemma,answer: nothing,False,nothing
35,So now the far left is going to have to admit that there is a difference between the brains of men and women and their behavior isn't just a social construct that is created by what toys they are raised with?,straw man,answer: appeal to ridicule,False,appeal to ridicule
36,So now the far left is going to have to admit that there is a difference between the brains of men and women and their behavior isn't just a social construct that is created by what toys they are raised with? Looks like the exception is charging to the rescue of the norm. Plot twist!,hasty generalization,answer: nothing,False,nothing
37,"The spider that bit was poison, therefore all spiders are poison.",hasty generalization,answer: hasty generalization,True,hasty generalization
38,What precisely makes these world leaders so convinced that climate change is a more urgent and massive threat than the incessant rampages of Islamist violence?,appeal to anger,answer: nothing,False,nothing
39,"These are unidentified people, and after the bomb goes off, they're blown to bits because they are suicidal individuals who think they're going to go to paradise if they perpetrate such an act and lose their life in doing it.",nothing,answer: nothing,True,nothing
40,smoking cigarettes is deadly because cigarettes can kill you,circular reasoning,answer: nothing,False,nothing
41,"Do any of you self-righteous pricks understand in the slightest capacity how nature works? There are 4.6 BILLION FUCKING YEARS of evolution on this planet across hundreds upon hundreds of millions of species and not a goddamned one of them, with the exception of you idiots, has any problem with killing for food.",ad hominem,"answer: fallacy of ad hominem

reasoning: the speaker is attacking the character of the listeners rather than addressing their argument or viewpoint. this is a common tactic used in an attempt to discredit someone's argument, but it doesn't provide any valid counter-argument or evidence against the listener's opinion.",True,ad hominem
42,"There are 4.6 BILLION FUCKING YEARS of evolution on this planet across hundreds upon hundreds of millions of species and not a goddamned one of them, with the exception of you idiots, has any problem with killing for food. It's in the DNA of every single creature on this planet, and it's the SOLE FUCKING REASON that either of us exist. Killing for food is 100% acceptable and morally right, and the suffering of the animals involved is fucking irrelevant. Lions don't give a fuck about the screams of a wildebeest as they disembowel it for a dinner. There is nothing, save for your ego, that gives you a reason to act or feel any different.",appeal to nature,answer: appeal to anger,False,appeal to anger
43,"Everybody who's looked at it, 500 economists, seven Nobel prize winners, say it's bad for the economy.",appeal to (false) authority,answer: appeal to authority,False,appeal to (false) authority
44,It's going to blow a hole in the deficit It's going to raise taxes on nine million people and require bigger cuts than the one I vetoed.,appeal to fear,answer: appeal to fear,True,appeal to fear
45,"It's going to blow a hole in the deficit It's going to raise taxes on nine million people and require bigger cuts than the one I vetoed. Our plan is better, it will take us into the future with a growing economy and healthier families.",false dilemma,answer: false dilemma,True,false dilemma
46,"Our plan is better, it will take us into the future with a growing economy and healthier families.",appeal to positive emotion,answer: appeal to the future,False,no match
47,"If indoor smoking laws are passed for bars, the bars will go out of business since people who drink, smoke while they drink.",causal oversimplification,answer: false dilemma,False,false dilemma
48,"You should drive on the right side of the road because that is what the law says, and the law is the law.",circular reasoning,"answer: fallacy of authority

explanation: the argument assumes that because something is a law, it must be correct or valid. laws are made by human beings and can sometimes be incorrect or unjust. therefore, it is a fallacy where an argument is considered to be valid simply because a law exists that supports the argument's premise.",False,appeal to (false) authority
49,"If that were the case, a lot of pro vaxxers wouldn't have an informed opinion either and let's be honest: they don't.",hasty generalization,"answer: fallacy of the single cause

in this statement, the claim is made that those who are against vaccination lack information while those in favor do not have an informed opinion. this type of reasoning assumes that there is only one reason for someone's position and ignores other potential reasons or influences on a person's beliefs. therefore, it is a fallacy where one assumes a single cause or explanation for the situation, when in reality there are often multiple contributing factors.",False,no match
50,"If that were the case, a lot of pro vaxxers wouldn't have an informed opinion either and let's be honest: they don't. Herd mentality is as much a thing as herd immunity.",equivocation,answer: appeal to groupthink,False,no match
51,"What antivaxxers need is someone with a PhD drawing a conclusion they agree with so they can repeat and circlejerk that to oblivion. And someone with a PhD should know the difference between an actual result and""oh hey one number out of 100 says this so it must be true"".",Appeal to Ridicule,answer: appeal to authority,False,appeal to (false) authority
52,"It happened because I could work with people -- Republicans and Democrats. That's why we've had 24 retired generals and admirals, hundreds of business people, many of them Republican, support this campaign. You have to decide whether you want to change or not.",appeal to (false) authority,answer: appeal to authority,False,appeal to (false) authority
53,You have to decide whether you want to change or not.,false dilemma,answer: nothing,False,nothing
54,Fortnite is the best game ever. Everyone is playing it!,ad populum,answer: appeal to popularity,False,ad populum
55,"Every sunrise, the rooster makes a sound. So it is the rooster which makes the sun rise.",false causality,answer: post hoc fallacy,False,false causality
56,I passed my math test after going out to the movies the night before. I should go to the movies the night before every math test!,false causality,answer: post hoc fallacy,False,false causality
57,"According to Freud, your belief in God stems from your need for a strong father figure. So don't you see that it's silly to continue believing in God?",Appeal to Ridicule,answer: fallacy of the complex question,False,no match
58,Human are omnivores. End of argument.,appeal to nature,answer: appeal to authority,False,appeal to (false) authority
59,I got into a discussion with someone on here who claimed that even though he supported legalized abortion and was pro choice he still received.,false dilemma,answer: nothing,False,nothing
60,And he was flippant and dismissive. The Eucharist is not a reward or something you deserve if you are obstinate to church teachings,ad hominem,answer: appeal to emotion,False,appeal to emotion (level 1)
61,"Choosing compassion over virtue signaling should not place any individual in mortal sin. After all, 51% of US Catholics believe abortion should be legal in all or most cases.",ad populum,answer: nothing,False,nothing
62,"I dont have to justify it, vegans assume most people consider an animal life to be on par with human life, its not.",straw man,answer: argumentum ad ignorantiam,False,no match
63,"There is nothing morally wrong about killing animals for food, you realise animals kill other animals for food too right?",appeal to nature,answer: fallacy of false analogy,False,false analogy
64,We won the Cold War because we invested and we went forward.,causal oversimplification,answer: nothing,False,nothing
65,"He was born to Catholic parents and raised as a Catholic until his confirmation in 8th grade. Therefore, he is bound to want to defend some Catholic traditions and, therefore, cannot be taken seriously.",false causality,answer: ad hominem,False,ad hominem
66,"Therefore, he is bound to want to defend some Catholic traditions and, therefore, cannot be taken seriously.",ad hominem,answer: ad hominem,True,ad hominem
67,"As a matter of fact, the tools now given to the terrorist fighters are the same tools that we've been using against drug dealers and white-collar criminals.",nothing,answer: nothing,True,nothing
68,My way of responding to difficult patients is by far the most ethical because no other way is so ethical and it is the only way that is completely ethical.,circular reasoning,answer: fallacy of composition,False,no match
69,"Well, democracy gave us Trump to the whole world. I'll let others judge what democracy is.",causal oversimplification,answer: fallacy of appeal to authority,False,appeal to (false) authority
70,"Chihuahuas are good inside dogs. German Shepherds are dogs; therefore, German Shepherds would be good inside dogs, too.",false analogy,answer: false analogy,True,false analogy
71,"Most animals, including humans are meant to consume meat. Humans would've probably died out by eating vegetables alone. So why not doing what we were meant to do by enjoying some salmon?",appeal to nature,"answer: fallacy of the natural fallacy. this is a type of argument that asserts something is true or morally right because it occurs in nature or because it is ""natural."" the assumption here is that whatever is 'natural' must be good or right, which is not necessarily the case.",False,no match
72,So why not doing what we were meant to do by enjoying some salmon? Or do you actually think fish is okay since you don't think they look cute?,Appeal to Ridicule,answer: appeal to cuteness,False,no match
73,The United States is the wealthiest nation in the world. So every American is wealthy.,fallacy of division,"answer: fallacy of composition

explanation: the fallacy of composition occurs when one argues that what is true for the parts is also true for the whole, which is not necessarily the case here. just because the united states is the wealthiest nation in the world does not mean every individual american is wealthy. wealth is distributed unevenly within a country, and some citizens might be poorer than people in other countries with lower overall gdps. therefore, it is a fallacy where a property of the whole is mistakenly attributed to each part of that whole.",False,no match
74,"As he goes by, the driver yells""get on the sidewalk where you belong!"" Sam sees that the car has Ohio plates and concludes that all Ohio drivers are jerks.",hasty generalization,answer: hasty generalization,True,hasty generalization
75,Advancement and maybe kickbacks? Either that or he's just a psychopath who gets off on destroying people's lives. Either way this asshole should never see the light of day again.,false dilemma,answer: appeal to (false) authority,False,appeal to (false) authority
76,Either that or he's just a psychopath who gets off on destroying people's lives. Either way this asshole should never see the light of day again.,ad hominem,answer: fallacy,False,no match
77,"only man is rational no women is man Therefore, no women is rational",equivocation,answer: fallacy of the excluded middle,False,false dilemma
78,"You should never gamble. Once you start gambling you find it hard to stop. Soon you are spending all your money on gambling, and eventually you will turn to crime to support your earnings.",slippery slope,answer: appeal to fear,False,appeal to fear
79,"If it is very low, for instance around one, it means greenhouse gas emissions are simply not worth doing anything about. But if ECS is high -- say, around four degrees or more -- then climate change is probably a big problem. We may not be able to stop it, but we' d better get ready to adapt to it.",false dilemma,"answer: appeal to fear

explanation: the statement appeals to the fear of global warming and its potential consequences as a reason to act on climate change. it does not provide substantial evidence or reasoning for why ecs is high, but rather tries to scare readers into believing that a higher ecs would be a problem worth adapting to.",False,appeal to fear
80,"Hopefully the police will use their resources on more serious issues such as knife crime, drug gangs and scooter criminals.",appeal to worse problems,answer: nothing,False,nothing
81,From a practicing judge?,ad hominem,answer: nothing,False,nothing
82,"So don't be upset someone is your age and way luckier than you, be thankful you weren't born into worse circumstances because there are likely plenty.",appeal to worse problems,answer: appeal to fear,False,appeal to fear
83,"Also, fun fact, they've done studies and if you make around $80k in the US anything beyond that doesn't really contribute to your overall happiness.",straw man,answer: appeal to emotion,False,appeal to emotion (level 1)
84,I think what's cooler about Post Malone and other wildly successful people is they are doing what they love doing. That's real success.,straw man,answer: nothing,False,nothing
85,We know God exists because he made everything,circular reasoning,"answer: appeal to (false) authority

explanation: the statement relies on the assumption that everything in existence is evidence of a higher power, which is an unproven and potentially false claim. it is an appeal to a false authority, as it assumes that what exists must have been created by god without providing any supporting evidence or reasoning.",False,appeal to (false) authority
86,"2 chicks rejected me for being a virgin. I had sex as soon as I started lying about having had sex. And all those weren't even casual sex, it was in the frame of relationships. Apparently it holds bearing on who you are as a person and you're not the same person when you loose it.",equivocation,answer: nothing,False,nothing
87,"The numbers show that we hit twice the audience with TV, and our focus groups remember the TV commercial 38 percent more than the radio slot.",nothing,answer: nothing,True,nothing
88,This is a ridiculous post and this mechanic will never be changed. Seat switching has always been a BF mechanic.,appeal to tradition,answer: nothing,False,nothing
89,Dont sit here and try and talk about realism or how you shouldnt be able to swap instantly between seats when there is hardly anything realistic about BF vehicle play in general.,Appeal to Ridicule,answer: nothing,False,nothing
90,Sounds like you need to get better if you are having trouble shooting down the most vulnerable aircraft in the sky.,Appeal to Ridicule,answer: appeal to authority,False,appeal to (false) authority
