,text,expected_label,actual_label,result
0,"You have no idea how street is, you better stop talking!",ad hominem,"the segment demonstrates the fallacy of ad hominem, which is characterized by attacking the person making the argument rather than addressing the argument itself. in this case, the fallacy present is ad hominem and it manifests when the speaker implies that the listener's lack of experience or knowledge about a topic invalidates their opinion, without providing any supporting evidence or logical reasoning to refute the original statement.",False
1,Yes. People who disagree with this statement are obviously brainwashed by Apple and can not argue objectively.,ad hominem,"in this statement, the speaker is accusing people who disagree with them as being brainwashed by apple and unable to argue objectively. this is an example of the ad hominem fallacy, which involves attacking a person's argument instead of addressing the content of their argument directly.",False
2,"He is a good charitable person, so yes he does.",ad hominem,"the segment contains the fallacy of hasty generalization. this fallacy occurs when a conclusion is drawn based on a small sample size or insufficient evidence. in this case, the conclusion that ""he does"" is made based solely on the information that ""he is a good charitable person."" the argument jumps to a conclusion without considering additional factors or context.",False
3,"Of course, because then they will not become such an intolerant person as my opponent.",ad hominem,"the given segment displays the fallacy of false dilemma. this particular fallacy is characterized by presenting only two options when, in reality, there may be more alternatives or a range of possibilities. in this case, the speaker implies that one must either become intolerant or not do something specific to avoid becoming intolerant.",False
4,"But think about the children he killed, they were laying in their own blood on the streets, eyes wide open. How can you talk to such a man?",ad hominem,"based on the provided list of logical fallacies and the context of the argument in the given segment, which fallacy is present in the following statement?

**segment:** but think about the children he killed, they were laying in their own blood on the streets, eyes wide open. how can you talk to such a man?

#### response template:
the segment utilizes the appeal to emotion fallacy, as it attempts to evoke strong emotions from the audience by describing a distressing scene of children being killed and left unattended, rather than presenting a rational argument or providing concrete evidence to substantiate its claim.",False
5,The germans are all criminals anyway after the holocaust,ad hominem,"the segment exhibits the fallacy of ad hominem. this type of logical error occurs when an individual's argument is targeted at attacking their character or personal traits instead of addressing the actual content of their argument. in this scenario, the speaker is making a generalized assumption that all germans are ""criminals"" as a result of past actions by a specific group, rather than focusing on the particular details and merits of the argument being presented.",False
6,"You are the antichrist, you want to destroy our belief in god.",ad hominem,"rephrased question:
when analyzing a specific argument, is it possible to pinpoint the particular logical fallacy present in the following statement? please take into account each type of fallacy mentioned in the list and offer an explanation for your selection.

segment: you are the antichrist, you want to destroy our belief in god.

response template:
the segment exhibits the fallacy of [fallacy name]. this fallacy is characterized by [brief description of the identified fallacy].",False
7,You're probably a drug addict yourself.,ad hominem,"in the given segment, the fallacy present is ad hominem. this fallacy involves attacking the person making the argument rather than addressing the substance or validity of the argument itself. instead of engaging with the content of the discussion, the statement ""you're probably a drug addict yourself"" seeks to undermine the speaker by suggesting that their opinion is influenced by their own alleged drug addiction, rather than focusing on the merits of the argument being presented.",False
8,Only people who are really dumb think celebrities get away with more crime.,ad hominem,"the segment is an example of the ad hominem fallacy. this fallacy occurs when a person's argument is dismissed or attacked based on personal attributes, rather than focusing on the substance of the argument itself. in this case, the statement implies that those who think celebrities get away with more crime are ""really dumb,"" without addressing the validity of the belief itself.",False
9,Anyone who doesn't want censoring must be a pervert.,ad hominem,"rephrased question and response template

rephrased question:
according to the explanation of an argument and the collection of potential fallacies, which fallacy can be detected in the following passage?

segment: anyone who doesn't want censoring must be a pervert.

response template:
the segment showcases the fallacy of ad hominem. this fallacy is present when the individual making the argument is targeted instead of the argument itself, which is evident in this case with the assertion that anyone who opposes censoring must be a pervert.",False
10,You are a criminal. So you should exit this discussion.,ad hominem,"rephrased question:
identifying the fallacy present in the given segment based on the definitions provided, which fallacy can be seen?

segment: you are a criminal. so you should exit this discussion.

response template:
the segment displays the fallacy of ad hominem. this type of fallacy is characterized by attacking an argument through targeting the person making the argument rather than addressing the merit or validity of their argument itself. in this case, instead of focusing on the content of the discussion, the speaker targets a personal attribute (their criminal status) to undermine the credibility of the other person's viewpoint.",False
11,"You have absolutely no idea, you probably never had a newspaper in your hand.",ad hominem,"the given segment contains the fallacy of appeal to ignorance. this fallacy occurs when someone assumes that because another person does not have personal experience or knowledge in a certain area (in this case, having a newspaper in their hand), they must be ignorant about the topic. this is a misleading and invalid assumption, as it disregards other potential sources of information or expertise that the listener may possess.",False
12,"Extinction is not natural, you dont know what you are talking about!",ad hominem,"the given argument demonstrates the ad hominem fallacy, as it focuses on discrediting the individual making the claim instead of engaging with the content of their argument. this type of fallacy is used to dismiss a claim by attacking the character of the person who made it, rather than addressing the merits or validity of the argument itself.",False
13,"You are one of those liberals with long hair,  right?",ad hominem,"the segment demonstrates a potential instance of the fallacy of ad hominem. this type of logical error involves attacking the character or personal traits of the individual making the argument instead of addressing the argument itself. in this case, the statement seems to be implying that having long hair and being liberal are somehow related, and using that as a basis for making a claim about the person's arguments.",False
14,"Everybody who sais, that global warning is no issue is a retard",ad hominem,"the segment demonstrates the presence of the ad hominem fallacy. this fallacy occurs when an argument attacks the person making the argument rather than addressing the validity or substance of the argument itself. in this case, the speaker is attacking the intelligence of those who disagree with them about global warming, rather than engaging with their actual position on the issue.",False
15,"Why do you want a university-doctor's title to be shown on their identification-card? You must be one yourself, you egotistic prick ! Does it make you feel respected that we all know your little title?",ad hominem,"the segment demonstrates the ad hominem fallacy, which is when an attack is directed at the person making the argument instead of addressing the content or substance of the argument itself. in this instance, the statement ""you must be one yourself, you egotistic prick!"" personalizes and targets the individual rather than engaging with the rationale behind wanting a university-doctor's title to appear on their identification card.",False
16,Have you ever watched a movie? I think you have no idea of movies.,ad hominem,"the provided segment commits the fallacy of ad hominem. this fallacy occurs when an argument is dismissed or rejected based on personal characteristics or attributes of the person presenting the argument, rather than evaluating the argument's merits on its own. in this case, the speaker is questioning the recipient's knowledge about movies without addressing the substance of their claim or providing any evidence to refute it.",False
17,"No, look at all the horrible things he is responsible for! You should not talk with such terrible persons.",ad hominem,"in the given segment, what particular logical fallacy is being committed as per the list of common logical fallacies?

segment: no, look at all the horrible things he is responsible for! you should not talk with such terrible persons.

answer: the fallacy of ad hominem is being committed in the provided segment. this fallacy occurs when an argument is discredited or attacked based on personal characteristics or background, instead of addressing the actual content of the argument. in this instance, the speaker is focusing on the individual making the argument and their perceived flaws, rather than engaging with the substance of their claim.",False
18,You’re way too nervous about driving at night so of course you don’t want to drive.,ad hominem,"the provided argument segment demonstrates the fallacy of hasty generalization. this fallacy occurs when a conclusion is drawn based on insufficient or limited evidence, without considering all relevant information. in this case, the assumption is made that the person's nervousness about driving at night directly correlates with their unwillingness to drive, without taking into account other possible factors or reasons for their hesitation.",False
19,"You are so damn soft and weak.  I guess you did never do sports, right?",ad hominem,"the provided segment demonstrates the fallacy of [ad hominem]. this fallacy occurs when an argument attacks the person making the argument rather than addressing the substance or logic of the argument itself. in this case, the statement criticizes the individual's character (being soft and weak) instead of engaging with their actual argument about not doing sports.",False
20,My opponent can’t possibly know how to balance a budget because she’s never run a business before.,ad hominem,"in the provided segment, the specific fallacy present is known as ""ad hominem."" this type of logical error involves directing an attack towards the person making the argument rather than addressing the substance of their claim. the speaker in this case criticizes their opponent's lack of business experience as a reason for her supposed inability to balance a budget, without focusing on the validity of her actual proposal or policy. this strategy diverts attention from the central issue at hand and instead attempts to discredit the individual making the argument.",False
21,It’s hard to take your claims seriously because you spend your days playing video games.,ad hominem,"the argument exhibits the fallacy of ad hominem. this type of logical error occurs when a person or their character is attacked rather than their argument being directly addressed and assessed. in this instance, the speaker dismisses the claims by targeting the individual's leisure activities, instead of evaluating the strength and validity of the arguments themselves.",False
22,Marx’s ideas are irrelevant today because the technologies we use and rely on would have been inconceivable to him.,ad hominem,"the given segment exhibits the fallacy of anachronism. this fallacy occurs when an argument is made that a concept, idea, or event is not applicable to a particular time period because it did not exist during that time, without considering that the concept could still be relevant if adapted to the context of that time. in this case, the claim is made that marx's ideas are irrelevant today due to modern technologies being inconceivable in his time, but this does not necessarily invalidate his ideas or their applicability to contemporary society.",False
23,Although Dr. Barone advocates for reducing our carbon footprints she lives in a large house and drives an SUV.,ad hominem,"the segment contains the fallacy of ad hominem. this fallacy occurs when an argument is attacked based on the person making it rather than addressing its substance, as the focus is shifted from dr. barone's advocacy for reducing carbon footprints to her personal choices and lifestyle.",False
24,Steve thinks Earth is flat so who knows what other crazy stuff he believes?,ad hominem,"the segment exemplifies the ad hominem fallacy. this type of fallacy involves dismissing an argument by attacking the individual who presents it, rather than focusing on the strength or validity of the claim itself. in this instance, the person's belief in a flat earth is used to criticize them without addressing the substance of their argument or offering a reasoned rebuttal.",False
25,Your lawn is overgrown; you’re the last person who should care about garbage on the sidewalk.,ad hominem,"the segment exhibits the fallacy of appeal to adversary (also known as tu quoque or ""you too"" fallacy). this fallacy is present when someone tries to divert criticism by pointing out that another person is also guilty of the same behavior, without actually addressing the main issue. in this instance, the concern about garbage on the sidewalk is dismissed by claiming that the listener should not be concerned about it because their lawn is overgrown. the response does not tackle the core problem and instead redirects attention to an unrelated matter.",False
26,you should be really stupid if you believe into such a thing.,ad hominem,"the segment exhibits an instance of the ad hominem fallacy. this type of logical error involves assaulting an argument based on the personal attributes or qualities of the person presenting the argument, rather than focusing on the substance of the argument itself. in this example, the speaker discredits the belief by insinuating that only foolish individuals would hold it, instead of offering a substantive counterargument to refute the belief.",False
27,Just because you would be a bad parent doesn't mean gay parents can't be good parents.,ad hominem,"the segment contains the fallacy of [appeal to contrary]. this fallacy occurs when one attempts to prove a point by citing an example that is contrary or irrelevant to the main argument, rather than directly addressing the argument itself. in this case, the statement does not provide any evidence or reasoning as to why gay parents can be good parents; it simply contradicts the idea that being a bad parent has anything to do with being gay.",False
28,Im sure you have no children. That is the reason why you write something like this.,ad hominem,"the segment contains the fallacy of ad hominem. this fallacy occurs when an individual's character, motive, or other irrelevant trait is attacked instead of the argument itself in order to undermine its credibility. in this case, the attack on the person's presumed lack of children is used to discredit their perspective or opinion, rather than addressing the substance of their argument.",False
29,I guess you are vegan. You can see what it makes out of people...,ad hominem,"the provided statement ""i guess you are vegan. you can see what it makes out of people..."" appears to contain the fallacy of appeal to nature. this type of logical fallacy occurs when an argument is deemed valid or invalid based on whether it is considered 'natural' or 'unnatural', without properly evaluating its actual merits or consequences.",False
30,Smoking must be safe because millions of people have been doing it for years.,ad populum,"in the given segment, the fallacy exhibited is hasty generalization. this fallacy is present when a conclusion is drawn from an insufficient sample size or without considering the larger context. the argument presented assumes that since millions of people have been smoking for years, it must be safe to do so. however, this overlooks important factors such as changes in public health knowledge and regulations over time, which may have led to a reduction in the negative effects associated with smoking.",False
31,Everyone is getting the new smartphone as soon as it comes out this weekend. You should get it too.,ad populum,"the segment exhibits the fallacy of bandwagon appeal, which is characterized by using the argument that something must be true or good because many people believe it or do it. in this case, the speaker is employing a form of bandwagon appeal to persuade their audience that they should get the new smartphone as well.",False
32,"9 out of 10 dentists prefer our brand, so it is the best.",ad populum,"the given segment illustrates the fallacy of [ad populum]. this type of fallacy occurs when an argument is considered valid or true because a majority of people believe in it or support it. in this particular case, the assertion that the product is the best is based solely on the fact that 9 out of 10 dentists prefer it, without taking into account other factors that could influence its quality or efficacy.",False
33,"The crowds at my Rallies are far bigger than they have ever been before, including the 2016 election. Never an empty seat in these large venues, many thousands of people watching screens outside. I am increasing in importance.",ad populum,"in the provided segment, the fallacy committed is appeal to popularity (also known as ad populum). this fallacy arises when an argument's validity or truthfulness relies solely on its popularity or acceptance among a majority of people, rather than on its logical soundness and factual accuracy. in this instance, the speaker attempts to establish their increased importance by referring to the size of their crowds, implying that popularity is directly related to truth or merit.",False
34,"The majority of our countrymen think we should have military operations overseas; therefore, it’s the right thing to do.",ad populum,"in the given segment, the fallacy present is known as ""ad populum,"" which is a type of argumentum ad verecundiam (appeal to authority). this fallacy occurs when an argument is considered valid because many people believe it, rather than being based on evidence or logical reasoning. the statement implies that the majority's opinion should determine what is right, without providing any solid justification for the action.",False
35,Three million fans can't be wrong!,ad populum,"in the given segment ""three million fans can't be wrong!"", the fallacy exhibited is known as ad populum. this logical error occurs when an argument's validity is determined solely by the number of people who support it, rather than examining the actual substance or evidence behind the claim.",False
36,"For such is the power true Godhead that it cannot be altogether and utterly hidden from the rational creature, once it makes use of its reason. For with the exception of a few in whom nature is excessively depraved, the whole human race confesses God to be author of the world.",ad populum,"rephrased question:
in the context of spotting logical fallacies in an argument, which kind of fallacy is present within the provided passage?

response template:
the excerpt exhibits the fallacy of appeal to tradition. this type of fallacy occurs when an argument is deemed valid or true simply because it has long been practiced or believed, without considering its merit or supporting evidence. in this instance, the passage asserts that the power of godhead cannot be concealed from a rational being due to the prevalence of this belief, and it concludes that god is the creator of the world based on the widespread confession of his existence.",False
37,"If all that the senses present to the mind is sensations, Berkeley must be right — but Berkeley assumed this premiss without any foundation or any proof of it. The size and shape of things are presented to us by our senses, yet every one knows that size and shape are not sensations.",ad populum,"the argument in the segment exhibits the fallacy of hasty generalization. this fallacy is characterized by drawing conclusions based on insufficient or incomplete evidence. in this case, the speaker makes a hasty generalization, assuming that because size and shape are not sensations, all other aspects of our understanding of objects must also be based solely on sensations. however, this conclusion is drawn from an insufficient sample size of our sensory experiences, leading to a flawed understanding of how we perceive the world around us.",False
38,"This is not the type of book I would usually read — it's common knowledge, at least to very petite women who shop for the latest fashions in the children's section, that it's a world designed for guys. But oh boy, there's so much more to it.",ad populum,"the segment contains the fallacy of appeal to ad hominem. this fallacy occurs when an argument is dismissed or rejected based on the personal characteristics of the person making the argument rather than evaluating the merit of the argument itself. in this case, the author dismisses the book's appeal by implying that only ""very petite women who shop for the latest fashions in the children's section"" would find it appealing, without addressing the actual content or value of the book.",False
39,"The Trump administration is being sued over its plans to include a question about citizenship in the 2020 Census, which California Attorney General Xavier Becerra says ‘is not just a bad idea — it is illegal.’ No, it's not. There is nothing wrong with asking about citizenship. Canada asks a citizenship question on its census. So do Australia and many other U.S. allies.",ad populum,"the segment demonstrates the fallacy of appeal to tradition. this fallacy is committed when an argument is based on the fact that something has been done in the past or is practiced by others, without providing any logical reasoning or evidence for its superiority. in this case, the argument appeals to tradition by mentioning that canada and australia ask a citizenship question on their census, suggesting that it should be acceptable and adopted in the u.s. as well.",False
40,Some of you hold to the doctrine of States' Rights as applying to woman suffrage. Adherence to that theory will keep the United States far behind all other democratic nations upon this question. A theory which prevents a nation from keeping up with the trend of world progress cannot be justified.,ad populum,"the passage demonstrates the fallacy of appeal to majority (ad populum), which is committed when an argument is deemed valid or true solely due to its widespread acceptance or popularity, without taking into account its actual legitimacy. in this case, the passage suggests that states' rights doctrine should be dismissed because it puts the united states behind other democratic nations in the matter of women suffrage. however, this conclusion is based on a majority consensus rather than examining the inherent merits of the doctrine itself.",False
41,"The human soul is immortal, because all learned men agree that anything which does not come out of the potentiality of matter is incorruptible and immortal.",ad populum,"the segment contains the fallacy of appeal to authority. this fallacy occurs when a statement or argument is considered true or valid simply because it is supported by an authority figure, without considering whether the authority is actually an expert on the subject or whether their expertise directly supports the claim being made.",False
42,Why are so many people attracted to the Pontiac Grand Prix? It could be that so many people are attracted to the Grand Prix!,ad populum,"the segment contains the fallacy of ad populum. this fallacy occurs when an argument is made based on popularity or common belief, rather than on solid evidence or logical reasoning. in this case, the claim that many people are attracted to the pontiac grand prix is used as a reason for why they might be, without considering other factors or providing any supporting evidence.",False
43,"I am one black woman who believes in America and loves this country, who believes that our future lies in Christianity, capitalism and the Constitution. And I am here to tell you that tens of millions of American of all backgrounds are with me — and are with President Trump.",ad populum,"the provided segment seems to commit the fallacy of appeal to popularity or bandwagon. this fallacy happens when someone argues that a belief or action is correct simply because many people believe in it or follow it, without providing any actual evidence or logical reasoning for its validity or effectiveness.",False
