,text,expected_label,actual_label,result
419,The occurrence of natural disasters coincides with military exercises or operations in certain regions. These disasters must be caused by covert military actions.,false causality,"the segment exhibits the fallacy of post hoc ergo propter hoc (latin for ""after this, therefore because of this""). this logical error occurs when someone assumes that because one event followed another in time, the first event must have caused the second event. in this case, the presence of natural disasters coinciding with military exercises or operations is taken as evidence that the disasters are caused by those actions, rather than considering other possible explanations or random occurrences.",False
420,The presence of unusual weather patterns correlates with sightings of unidentified flying objects. These UFOs must be manipulating the weather.,false causality,"rephrased question:
please examine the given text and identify the type of logical fallacy it contains. the text states: ""the occurrence of abnormal weather conditions is connected to reports of unidentified flying objects. these ufos are causing the unusual weather.""

response template:
in the provided text, the fallacy present is false causality. this occurs when a cause-and-effect relationship is assumed between two events or phenomena based on their occurrence together, without any solid evidence to substantiate such a connection. here, the abnormal weather conditions and ufo sightings are correlated, but no clear causal link has been established between them.",False
421,After the introduction of genetically modified foods there was an increase in reported cases of cancer. GMOs must be causing cancer.,false causality,"the segment demonstrates the fallacy of [causal oversimplification]. this type of error occurs when a single cause is assigned to an outcome, even though there may be multiple potential causes at play. in the given scenario, the link between genetically modified foods and an increase in reported cancer cases is overly simplified by attributing the entire observed trend solely to gmos, without taking into account other possible contributing factors or offering sufficient evidence to substantiate this assertion.",False
422,The discovery of ancient artifacts coincides with mysterious disappearances or accidents. Therefore these artifacts must be cursed or possessed.,false causality,"the segment demonstrates the fallacy of post hoc ergo propter hoc. this fallacy occurs when it is incorrectly assumed that because one event occurred before another, the first event must have caused the second event to happen. in this case, the argument assumes that since ancient artifacts were discovered before mysterious disappearances or accidents, the artifacts themselves must be responsible for these events. this reasoning fails to consider alternative explanations and does not establish a logical connection between the two phenomena.",False
423,"I would never hurt a puppy nor ask anyone else to. Pets are not used in animal testing. Again, would you save a diseased rat over yourself?",false dilemma,"the segment demonstrates the fallacy of appeal to emotion, more specifically the appeal to pity. this type of logical fallacy involves manipulating emotions, such as pity, instead of presenting a logical argument supported by evidence. in this example, the mention of a diseased rat and the question about saving oneself is designed to evoke sympathy for the rat while avoiding a rational debate on animal testing.",False
424,Testing on animals could save the life of you or a family member. Do you really think the life of your child is less important than a mouse?,false dilemma,"the segment presents the fallacy of false dichotomy. this fallacy occurs when a statement presents only two options, implying that there are no other alternatives or courses of action available. in this case, it suggests that either the life of a child is considered less important than that of a mouse or testing on animals could save the life of a human.",False
425,you’re either with us or against us,false dilemma,"rephrased question:
kindly examine the given text and identify the fallacy present. the text says, ""you’re either with us or against us.""

#### response template:
the text features the fallacy of false dilemma. this fallacy arises when only two options are presented as the sole possibilities, even though additional alternatives exist. in this instance, the statement suggests that there are only two options - supporting ""us"" or opposing ""us,"" which simplifies the situation and restricts the potential viewpoints or stances one might adopt.",False
426,America: Love it or leave it.,false dilemma,"the segment exhibits the binary fallacy. this fallacy is characterized by presenting only two options or alternatives, often as if they are the only possible choices. in this case, the segment implies that one must either fully support america without any criticism (love it) or completely reject america and its values (leave it), which can be considered an example of the false dilemma fallacy.",False
427,Death is nothing to fear. It is either annihilation or migration.,false dilemma,"the segment contains the fallacy of causal oversimplification. this fallacy occurs when a single cause is attributed to an outcome that has multiple causes, as in this case where death is oversimplified as either annihilation or migration without considering other potential factors or perspectives.",False
428,Be my friend or be my enemy.,false dilemma,"the given segment contains the fallacy of false dilemma. this fallacy occurs when a statement presents only two options, neither of which are true or reasonable, implying that there is no other possible stance on the issue. in this case, the speaker implies that either someone joins their cause or they are against it, without considering other potential viewpoints or positions one could take.",False
429,Are you a Republican or a Democrat?,false dilemma,"the segment does not contain any specific logical fallacies, as it is simply asking a question without making an argument or drawing a conclusion. it may be interpreted as a straw man fallacy if it implies that being either a republican or a democrat are the only two options available and that choosing one over the other would settle the issue at hand. however, without further context or argumentation, it is difficult to definitively identify a logical fallacy in this segment.",False
430,"If you're not going to heaven, you must be going to you-know-where.",false dilemma,"the segment contains the fallacy of false dilemma. this fallacy occurs when a statement presents only two options, when in reality there may be more than two possible outcomes or alternatives. in this case, the statement implies that if you're not going to heaven, you must be going to the other place (you-know-where), neglecting the possibility of other destinations or scenarios.",False
431,"Good students will study and learn without the threat of an exam, and bad students won't study and learn even with the threat of an exam. So, exams serve no purpose",false dilemma,"the segment demonstrates the false dichotomy fallacy, which is characterized by presenting only two options as if they are the only possibilities, when in reality there may be other alternatives. in this case, the argument commits the fallacy of false dichotomy by suggesting that students either study and learn without the threat of an exam (good students) or don't study and learn even with the threat of an exam (bad students). this oversimplification ignores the possibility of other factors influencing a student's motivation to study and learn, such as personal interest in the subject matter or intrinsic motivation.",False
432,"Since there is nothing good on TV tonight, I will just have to get drunk.",false dilemma,"rephrased question:
considering the numerous logical fallacies mentioned, can you determine which one is present in the following text: ""since there is nothing good on tv tonight, i will just have to get drunk.""

text: since there is nothing good on tv tonight, i will just have to get drunk.

response template:
the given text demonstrates the fallacy of slippery slope. this error in reasoning suggests that a minor event or action will inevitably lead to significant and often exaggerated consequences without sufficient evidence or justification. in this instance, it implies that not finding anything good on tv must result in getting drunk, ignoring the possibility of alternative activities or coping strategies.",False
433,"Obviously great mathematicians are born, and not made. John had all the best opportunities and is only mediocre at math. But Kara was good at math from the beginning.",false dilemma,"**rephrased question:** in light of the provided argument and its possible logical fallacies, can you identify which specific type of fallacy is present in this segment? please consider each fallacy individually and offer a comprehensive explanation for your conclusion.

**segment:** it's evident that exceptional mathematicians are born, not developed. although john had access to the finest resources, he is only average when it comes to math. conversely, kara excelled at math from the start.

#### response template:
the segment demonstrates the fallacy of hasty generalization. this fallacy arises when a conclusion is drawn based on a limited set of examples, as seen in this case by using john's experience to generalize about all mathematicians.",False
434,"On the quad, I see the jocks in one corner, the rebels in another, and the intellectual set in yet another. Which one of these groups do you hang out with?",false dilemma,"the segment exhibits the fallacy of appeal to adversarial roles. this fallacy occurs when individuals are classified based on their social group or stereotype rather than being judged as individuals, and it assumes that all people within a particular group will possess certain traits.",False
435,"You ask how I can know that you're struggling financially?  It's simple: in a capitalist economy, you either win big or you lose big, and I know you're not one of the big winners.",false dilemma,"the segment demonstrates the fallacy of hasty generalization. this error occurs when a conclusion is drawn based on limited evidence or an insufficient sample size, which is evident in this case as the speaker makes a generalization about someone's financial situation solely because they are not among the ""big winners"" in a capitalist economy.",False
436,"If we don’t order pizza for dinner, we’ll have to eat the week-old spaghetti in the fridge.",false dilemma,"the segment demonstrates the fallacy of false dilemma. this fallacy occurs when an argument presents only two options as if they are the sole possibilities, disregarding any other alternatives or choices that might be available. in this case, the argument implies that there are only two options for dinner - ordering pizza or eating week-old spaghetti - without considering other potential alternatives like cooking a different meal or ordering food from another type of restaurant.",False
437,"Use our fertilizer, or your crops will wither.",false dilemma,"in the context of a given argument and list of potential fallacies, identify the logical error present in the provided segment.

segment: ""use our fertilizer, or your crops will wither.""

response template:
the segment demonstrates the fallacy of false dichotomy. this fallacy occurs when an argument presents only two options, implying that there are no other alternatives or solutions. in this case, the speaker suggests that using their specific fertilizer is the only way to prevent crop withering, even though there might be other factors or alternative solutions for maintaining crop health.",False
438,5 out of 7 doctors recommend this medication over its direct competitor.,false dilemma,"the statement ""5 out of 7 doctors recommend this medication over its direct competitor"" demonstrates the presence of the appeal to authority fallacy. this fallacy is committed when an argument's validity or truth relies solely on the perceived expertise of the person making the claim, in this case, the doctors.",False
439,"If we want to make campus safer, we can either install more security cameras or ban visitors.",false dilemma,"the provided segment presents a false dilemma, as it assumes that making campus safer can only be accomplished through either installing more security cameras or banning visitors. however, this argument overlooks other possible options and strategies for enhancing safety on campus.",False
440,“You either support all government policies or you leave the country.”,false dilemma,"the segment employs the false dilemma fallacy. this type of fallacy occurs when only two options are presented as the sole possibilities, while there may be additional alternatives that are not considered. in this instance, the speaker is incorrectly limiting the choices to either complete support for all government policies or leaving the country, thereby disregarding the possibility of critiquing certain policies without renouncing one's citizenship or backing for other policies.",False
441,"Every nation, in every region, now has a decision to make. Either you are with us, or you are with the terrorists.",false dilemma,"the argument presented in the segment appears to exhibit the fallacy of false dilemma. this occurs when an argument presents only two options as the sole possibilities, while there may be other viable alternatives or perspectives that have not been considered. in this case, the options are ""being with us"" or ""being with the terrorists,"" which oversimplifies the complexities and potential nuances of various nations' positions in a particular situation.",False
442,I didnt watch the worldcup.  But he did a good job in the Bundesliga. Im sure he was the best.,hasty generalization,"the segment demonstrates the presence of the ""false cause"" fallacy, which occurs when a connection between two events is assumed without proper justification or evidence. in this case, the fallacy is the assumption that because a person performed well in one league (bundesliga), they must have been the best overall without taking into account their performance in other leagues or competitions like the world cup. this reasoning overlooks important information that could impact the accuracy of the conclusion, thus making it a fallacy.",False
443,"I do just think, that germany is fair. You got a health-insurance for everyone, even for celebs. Thats why legal system has to be fair, too.",hasty generalization,"the segment contains the fallacy of false analogy. this fallacy occurs when a comparison is made between two things that are not equivalent or logically related, and the conclusion drawn from the comparison is not valid. in this case, the speaker compares germany's health-insurance system to its legal system without considering if the principles of fairness can be directly applied from one system to the other.",False
444,"If I look at all these global organizations (OSN, NATO, EU commission), it just seems a global force is made for profit of only these guys sitting there. They do only care about themselves. Will then this new global force be different? I doubt so, this is the same sort of people.",hasty generalization,"the segment appears to exhibit the fallacy of hasty generalization. this error occurs when a conclusion is drawn based on insufficient or limited evidence, leading to an overly broad or inaccurate generalization. in this case, the speaker makes a sweeping statement about global organizations based on their personal observations and beliefs, without considering other factors or evidence that might challenge their assumption.",False
445,A friend of mine lives vegan. He got ill. Veganism is bad for everybody.,hasty generalization,"the given segment demonstrates an instance of the hasty generalization fallacy. this fallacy occurs when a conclusion is drawn from insufficient evidence or a single example, such as attributing the illness of one individual following a vegan lifestyle to veganism being bad for everyone.",False
446,Inception did not get 11 Oscars. So Titanic shouldnt get 11 oscars as well. Both movies had Leonardo di Caprio as main-actor.,hasty generalization,"the segment contains the fallacy of false causality. this fallacy occurs when a cause is incorrectly assumed to be responsible for an effect, or vice versa. in this case, the argument assumes that because inception did not win 11 oscars, titanic should not either, without considering other factors such as differences in the films' plots, themes, and overall quality.",False
447,"School detention is great, it was good for me. I did never do homework, thats why my teacher forced me to detention. My grades went up from 3,5 to 2.",hasty generalization,"the segment contains the fallacy of hasty generalization. this fallacy occurs when a conclusion is drawn based on a small sample size or an unrepresentative group, which may not be applicable to a larger population. in this case, drawing the conclusion that school detention is great for everyone based on personal experience alone is a hasty generalization because it does not account for other students' experiences and circumstances.",False
448,I helped at a refugee-welcome-station. I didnt see a refugee commit crimes. I think no refugee committed crimes until cologne.,hasty generalization,"the segment demonstrates the fallacy of false cause. this fallacy occurs when a cause is incorrectly attributed to an event due to an assumption rather than evidence, which is present in this case as the author assumes that no refugee committed crimes until cologne without providing any supporting data or context.",False
449,School detention in high school means more school and less freetime. Less freetime lead to severe psychological problems for a schoolmate of mine. Therefore it does not do any good.,hasty generalization,"the segment contains the fallacy of appeal to anecdote. this fallacy occurs when an argument is based on a single personal experience or story, rather than on objective evidence or scientific data. in this case, the argument claims that school detention led to severe psychological problems for the speaker's friend, but does not provide any generalizable evidence to support this conclusion.",False
450,"A global task force to stop Ebola solved the issue, so this environment task force will do its job, too.",hasty generalization,"the segment demonstrates the fallacy of false analogy. this type of logical fallacy occurs when a comparison is drawn between two situations or entities based on similarities without considering the differences that could affect the outcomes. in this case, the argument makes an analogy between the global task force to stop ebola and the environment task force, assuming that if one was successful, so will be the other, despite potential differences in objectives, challenges, and resources involved.",False
451,Christiano Ronaldo played so bad in 2014. He cannot be the best in 2016.,hasty generalization,"the segment demonstrates the fallacy of hasty generalization. this fallacy occurs when a conclusion is drawn from insufficient evidence or a limited sample size. in this case, the segment exhibits the hasty generalization fallacy because it draws a conclusion about christiano ronaldo's performance in 2016 based on his performance in 2014, without considering other factors or his performance during the intervening years.",False
452,My sister is only watching TV and talks less than earlier. TV is bad for communication among family-members.,hasty generalization,"the argument presented exhibits the fallacy of hasty generalization. this error occurs when a sweeping conclusion is drawn from insufficient or limited evidence, as demonstrated in this case where the author deduces that tv is detrimental to family communication based solely on their sister's behavior.",False
453,"My son has developed anxiety because of the continuous grading. It is bad for all students in high school,  too much pressure...",hasty generalization,"the segment contains the fallacy of hasty generalization. this fallacy occurs when a conclusion is drawn based on a limited or insufficient evidence, such as one person's experience being used to make a broad statement about all students in high school.",False
454,Its beneficial for handicapped children to study with healthy ones. So its also the other way round.,hasty generalization,"the segment commits the fallacy of false dilemma. this fallacy arises when a limited number of options are presented, and an incorrect conclusion is drawn based on these options alone, disregarding other possible solutions or factors. in this case, the statement implies that there are only two ways to approach education for handicapped children - either they study with healthy children or vice versa. this oversimplification ignores other educational approaches and opportunities available for handicapped children.",False
455,I dont know a healthy person that wants to suicide. No healthy person wants this.,hasty generalization,"in considering the various logical fallacies, it can be seen that the provided argument segment contains the fallacy of hasty generalization. this fallacy takes place when a conclusion is derived from an insufficient or unrepresentative sample of cases. in this case, the speaker's personal knowledge of healthy individuals who do not want to commit suicide serves as the basis for the claim that ""no healthy person wants to commit suicide.""",False
456,"No, because if one company sends jobs to developing countries, then they all will.",hasty generalization,"the statement contains the fallacy of the slippery slope. this fallacy occurs when an argument assumes that a minor action or event will lead to major and often exaggerated consequences, without providing evidence for such an assumption. in this case, the assumption is that if one company sends jobs to developing countries, all companies will do the same, but there is no clear reasoning or evidence to support this conclusion.",False
457,"Past years and data have shown us that non-Europeans who have immigrated to Europe do not often cause issues and some even boost the economy. Therefore, all non-Europeans can and will boost European economy and preserve the integrity of European countries.",hasty generalization,"the segment contains the fallacy of hasty generalization. this fallacy occurs when a conclusion is drawn based on a small sample size or limited data, as in this case where the argument generalizes all non-europeans' impact on the economy and preservation of european countries based on the experiences of a few individuals.",False
458,I dont care. Since the attacks from cologne i know how what refugees are: Criminals. And criminals dont belong here. Send them all back!,hasty generalization,"the given segment demonstrates an appeal to fear, as it relies on the fear of refugees being criminals in order to support the argument that they should be sent back. this fallacy is used to persuade through the manipulation of emotions rather than presenting a logical and reasoned argument.",False
459,Temelin exploded. It is never ok to use it.,hasty generalization,"the statement contains the fallacy of appeal to ignorance. this fallacy arises when one asserts that a claim is true or false solely because there is no evidence or proof available to support or refute it. in this case, the claim that ""we cannot go to space because there is no proof that it exists"" relies on the absence of evidence rather than considering the substantial body of evidence that supports the existence and accessibility of space.",False
460,"Yes, because we were attacked, and if we don't go to war we will be attacked again.",hasty generalization,"in the context of evaluating an argument and considering a list of potential fallacies, the segment ""yes, because we were attacked, and if we don't go to war we will be attacked again"" demonstrates the presence of the slippery slope fallacy. this fallacy is committed when a small action or event is claimed to lead to significant and often extreme consequences without adequate justification.",False
