,text,expected_label,actual_label,result
645,"That is true. However, we cannot be sure others will be responsible.",nothing,"the segment demonstrates the fallacy of hasty generalization. in this case, the fallacy occurs when the argument generalizes from one specific instance or example to all instances of a given category, without sufficient evidence or justification. this can lead to an oversimplification of the situation and potential misconceptions about the behavior or actions of others.",False
646,Censorship helps protect children.,nothing,"the segment includes an appeal to fear fallacy, which is when an individual tries to persuade others by instilling fear or anxiety about potential negative outcomes instead of providing solid logical arguments and evidence. in this instance, the statement suggests that without censorship, children would be exposed to harm, relying on fear as a tactic to strengthen the case for censorship.",False
647,"With the actual milk price, the cows can be appropriately held, and the farmers can still achieve some earnings.",nothing,"**rephrased question:** which logical fallacy can be identified in the given statement, and why does it qualify as an example of that fallacy?

**segment:** with the actual milk price, the cows can be appropriately held, and the farmers can still achieve some earnings.",False
648,"Yes, homeschooling, everyone.",nothing,the segment does not provide sufficient information for identifying a logical fallacy. please provide more context or details.,False
649,I think Titanic deserves 11 Oscars at once.,nothing,"the segment contains the fallacy of hasty generalization. this fallacy occurs when a conclusion is drawn based on a small sample size or limited evidence, without considering other relevant factors or information. in this case, the argument assumes that titanic's perceived success justifies it receiving 11 oscars at once, without taking into account the opinions of others, the overall quality of competing films, or the diverse categories in which oscars are awarded.",False
650,"He killed, yes. But this does not mean that it is impossible to talk to him. If we can save lives by this way, we should do it.",nothing,"the fallacy observed in the segment is appeal to tradition. it manifests when an argument is made based on the assumption that something is good or right because it has been done in a certain way for a long time or according to cultural norms, without considering other factors or potential alternatives.

in this case, the argument implies that we should be able to talk to someone who committed a crime and potentially save lives, based on the tradition of giving second chances and rehabilitation. however, it does not consider the severity of the crime, public safety concerns, or the rights of victims.",False
651,The current grading system just fails.,nothing,"the argument contains the fallacy of hasty generalization. this fallacy occurs when a conclusion is drawn based on a small sample size, without adequate evidence or consideration of alternative perspectives. in this case, the claim that the entire grading system ""just fails"" is a generalized statement made from potentially limited experience or examples, rather than an analysis of the system as a whole.",False
652,Democracy is peaceful.,nothing,"the provided argument segment ""democracy is peaceful"" does not contain any logical fallacies. it is a simple statement expressing an opinion or belief about democracy being associated with peacefulness. however, it's important to note that this statement can be debated based on historical examples and current events in different countries and political contexts.",False
653,Adolescence is hard enough without having to try learning in an environment of hormone-laced competition and distraction.,nothing,"the segment exhibits the fallacy of [straw man]. this fallacy occurs when a person or argument is misrepresented or oversimplified so that it can more easily be attacked or discredited. in this instance, the argument presents adolescence as inherently difficult and implies that any attempt at learning in an environment with competition and distraction would lead to significant problems due to hormonal influences. this oversimplification does not account for potential strategies or support systems that could help manage or mitigate these factors.",False
654,"The technical expertise is there, having space ships, airplanes etc., and sooner or later humans have always used technology to their advantage and to make things more comfortable/easier for them.",nothing,"after analyzing the segment, it appears that the fallacy of hasty generalization is being committed. this fallacy involves drawing a conclusion based on a limited sample size or insufficient evidence. in this case, the argument asserts that because humans have utilized technology to their advantage in some instances (e.g., space ships and airplanes), they will always do so without considering possible exceptions or alternative outcomes.",False
655,Same-sex couples should have access to the same benefits enjoyed by heterosexual married couples.,nothing,the segment does not contain a fallacy. it is simply a statement expressing the opinion that same-sex couples should receive equal treatment in terms of benefits as compared to heterosexual married couples. there is no use of ambiguous language or misrepresentation of truth in this statement.,False
656,"Alle, die hier leben sollten auch involviert sein, wenn es darum geht was hier in Zukunft passiert. (Everyone living here should also be involved when it comes to deciding what happens here in the future.)",nothing,"in this segment, there is no identifiable fallacy. the statement appears to be a suggestion for inclusiveness and active participation in decision-making processes related to the future of the community where people are living.",False
657,"Smoking at home is dangerous, as exactly as eating cheese at home or walking up and down stairs. There is no explicit reason to make it illegal.",nothing,"the provided text exhibits the fallacy of false analogy. this type of fallacy occurs when an argument makes a comparison that is misleading because it overlooks significant differences between the compared subjects, such as the distinct risks and regulations associated with smoking at home in contrast to eating cheese at home or walking up and down stairs.",False
658,Microsoft can't be the new Apple. Apple focuses on innovative design. Microsoft focuses on software for productivity and products that don't have to be innovative in design.,nothing,"the segment contains the fallacy of hasty generalization. this fallacy occurs when a conclusion is drawn based on a small sample size or limited information, without considering all relevant factors. in this case, the statement generalizes about microsoft and apple without taking into account the entire range of products and innovations within both companies.",False
659,"Some shows on TV serve educational purposes, but most of them are totally worthless. There is no chance that a mind of a child builds up, when it watches Celebrity-news.",nothing,"rephrased question:
please analyze the given statement, determine the specific logical fallacy it displays from the list provided, and provide a detailed explanation as to why it embodies that particular type of fallacy.

segment: some educational tv shows do exist, but the majority of them are completely useless. a child's mind cannot develop properly when they watch celebrity news.

response template:
the segment displays the logical fallacy of [fallacy name]. this can be categorized as a [specific type of fallacy] because it involves [short explanation of the identified fallacy]. the statement exhibits this fallacy due to [brief description of how the segment embodies this fallacy].",False
660,"Yes, companies are already working on creating cars which are able to fly quite successfully. Thus, flying cars will become reality in the near future.",nothing,"the segment demonstrates the fallacy of hasty generalization. this fallacy occurs when a conclusion is drawn based on a small sample size or limited evidence. in this case, the argument for flying cars becoming a reality in the near future relies on the fact that some companies are working on creating flying cars, without considering factors such as technological challenges, regulatory hurdles, and market acceptance.",False
661,"Yes, school uniforms do create a better learning environment.",nothing,"in the context of evaluating an argument and considering a list of potential fallacies, which fallacy can be observed in the given segment: ""yes, school uniforms do create a better learning environment.""?

segment: yes, school uniforms do create a better learning environment.

response template:
the segment exhibits the fallacy of hasty generalization. this fallacy is committed when a conclusion is drawn based on insufficient evidence or without considering all relevant factors. in this case, the argument asserts that school uniforms enhance the learning environment without providing adequate proof or taking into account various elements that could influence the educational experience.",False
662,Home school provides a better education than underfunded public schools.,nothing,"the identified fallacy in the segment is ""hasty generalization,"" which takes place when a conclusion is drawn from insufficient or unrepresentative evidence. in this case, the claim that home school provides a better education than underfunded public schools is based on a narrow and potentially biased perspective, rather than considering the diverse experiences of students in various educational settings.",False
663,Alternative energy resources are too expensive.,nothing,"rephrased question:
according to the given definition of an argument and the collection of possible logical errors, could you identify the type of fallacy present in the following statement: ""alternative energy resources are too expensive.""?

segment: alternative energy resources are too expensive.

response template:
the segment demonstrates the fallacy of [fallacy name]. this fallacy is characterized by [brief description of the recognized fallacy].",False
664,This would cause significant disadvantages for children from non-academic families.,nothing,"the statement exhibits the fallacy of appeal to tradition. this fallacy occurs when an argument is presented based on a belief or practice that has been longstanding, despite any evidence supporting its effectiveness or validity in the current context. in this case, the argument assumes that being from a non-academic family is inherently disadvantageous for children without considering other factors or potential advantages those families might possess.",False
665,Animal testing for medical purposes should be allowed.,nothing,"the fallacy present in the statement ""animal testing for medical purposes should be allowed"" is appeal to tradition. this fallacy occurs when an argument is made that something is better or more acceptable simply because it has been done traditionally, without considering its current validity or effectiveness. in this case, the statement suggests that animal testing should be allowed due to its longstanding practice, without addressing the ethical or scientific concerns related to modern alternatives.",False
666,Microsoft is the new apple.,nothing,"the given segment does not contain a specific fallacy, as it is not making any comparative or contradictory claims. however, it can be considered an example of the fallacy of false analogy if taken in a broader context. this fallacy occurs when two things are compared without proper consideration of the relevant similarities and differences between them.",False
667,"It is obvious that anyone has been on the moon. Meanwhile, 2015, there have been quite a lot expeditions to the moon. The newer ones were even livestreamed on Twitter and co. Don't tell me the government fakes livestreams.",nothing,"the fallacy in the provided segment is appeal to authority. this occurs when an argument is accepted as true or valid due to its association with a perceived expert or authority, without properly evaluating the credibility and expertise of that source. in this case, the moon landings are assumed to be true because they were livestreamed on social media platforms, which does not necessarily guarantee their authenticity.",False
668,To find out if there is a reason for the American war on terror let's take a look at the results nearly one and a half decade later.,nothing,"the segment contains the fallacy of circular reasoning. this fallacy occurs when the premise and conclusion are essentially the same, as in this case, where the argument seems to be suggesting that there is a reason for the american war on terror because the results after nearly one and a half decade should show a reason for it.",False
669,Cellphones should be banned from classrooms.,nothing,"the segment contains the fallacy of ad hominem. this fallacy occurs when the argument attacks the person making the claim, rather than addressing the validity of the claim itself. in this case, the statement ""cellphones should be banned from classrooms"" is an ad hominem fallacy because it does not provide any substantive reasons for banning cellphones but instead targets individuals who may use them in the classroom.",False
670,It is best to home school our kids.,nothing,"the segment exhibits the fallacy of hasty generalization. this fallacy emerges when a conclusion is drawn based on insufficient evidence or a limited number of cases. in the context of this argument, the fallacy appears as follows: the statement ""it is best to home school our kids"" is a general claim about the superiority of homeschooling for all children, without providing enough evidence or considering the diverse needs and circumstances of individual children.",False
671,"It has to be balanced, but for life-saving drugs, it should be allowed on non-endangered animal species.",nothing,"in the given argument, the specific type of logical fallacy observed is the false dilemma. this fallacy arises when only two options are presented as the sole possibilities, even though other alternatives exist. the segment implies that either the use of life-saving drugs is balanced and applied to non-endangered species or it is not allowed at all. however, there may be alternative ways to balance the use of these drugs without necessarily applying them to non-endangered species.",False
672,Animal testing helps to improve medical care for everybody.,nothing,"the statement ""animal testing helps to improve medical care for everybody"" presents a fallacy of appeal to tradition. this fallacy arises when an argument is made based on the belief that a practice is valid or beneficial simply because it has been done in the past and is considered traditional. in this instance, the argument implies that animal testing should be maintained as a standard method for medical research due to its historical usage. however, this does not guarantee that animal testing is the most effective or ethically sound approach to improving healthcare for everyone.",False
673,"They brought several kilos of moon rocks back to earth, and you cannot simply fake four billion years old rock material.",nothing,"in the given segment, the fallacy present is the appeal to nature. this fallacy is committed when an argument is made that something is good due to its natural origin or bad because it is unnatural. the segment suggests that moon rocks cannot be counterfeited since they are a result of natural processes over four billion years ago.",False
674,"I don't think so, he lived too short in order to have the most influence. Dr. Dre for example had much more influence. He started the rap-movement with Eazy-E and Ice Cube. He just sold his headphone brand for around 250 million dollars. This amount of money shows how influential Dr. Dre is. Tupac never had this much money.",nothing,"the segment contains an appeal to false authority fallacy. this fallacy is present when an argument is made based on the authority of a person or entity that doesn't possess the proper credibility, giving the impression that their influence is greater than it actually is. in this case, the author points to dr. dre's headphone brand sale and his involvement in the rap movement as evidence of his greater influence compared to tupac, even though the sales figure might not be directly related to success or impact in music.",False
675,Marijuana has been shown to be effective in treating glaucoma.,nothing,"the segment includes the fallacy of hasty generalization. this fallacy occurs when a conclusion is drawn from insufficient evidence or a limited sample, which may not accurately represent the whole population. in this case, the statement that marijuana has been shown to be effective in treating glaucoma is based on limited evidence and may not be applicable to all cases of glaucoma.",False
676,That Marijuana should be legalized.,nothing,"the provided argument contains an appeal to nature fallacy, as it assumes that because marijuana is a natural substance and has been used for centuries, it should be legalized without considering other factors such as potential risks or negative consequences. this type of logical error focuses on the origins or characteristics of something rather than evaluating its actual merits or drawbacks.",False
677,"Although any suffering of living creatures should be avoided, I guess it's commonly accepted by the society that medical purposes testing has more benefits than harms.",nothing,"the segment contains the fallacy of appeal to adversarium. this fallacy occurs when an argument is considered valid or true because it is widely accepted by society, even if it goes against a fundamental principle or belief. in this case, the acceptance of medical purposes testing despite causing suffering to living creatures is based on societal consensus rather than a thorough ethical evaluation.",False
678,"This programming language is open for everybody, so it encourages more developers to participate.",nothing,"the argument seems to fall into the trap of appeal to conventional wisdom. this fallacy occurs when an argument is based on a widely held but incorrect belief or assumption, without considering counterexamples or alternative perspectives. in this case, the argument assumes that because the programming language is open for everybody, it encourages more developers to participate, ignoring potential barriers or limitations that may discourage participation.",False
679,Only a few countries contribute to the majority of pollution.,nothing,"the statement ""only a few countries contribute to the majority of pollution"" contains the fallacy of causal oversimplification. this fallacy arises when one attributes a single cause to an outcome that has multiple contributing factors. in this instance, the argument oversimplifies the issue of pollution by focusing solely on the contribution of a few countries while neglecting other significant contributors such as industrial processes, transportation, and consumer habits.",False
680,Renewable energy sources will not soon replace fossil fuels.,nothing,"the segment does not contain a fallacy, as it is simply a statement expressing an opinion or prediction about the future of energy sources. however, if we were to assume there was a hidden fallacy, it might be:

**response template:** the segment contains the fallacy of [hasty generalization]. this fallacy occurs when a conclusion is drawn based on insufficient evidence or a single example, and in this case, it implies that renewable energy sources will not replace fossil fuels without providing any specific reasons or supporting arguments.",False
681,"Well, Ebola is a disease and it makes sense to coordinate countries worldwide to fight against it. To me, global environmental task force sounds fuzzy without a clear purpose. We don't need such an organization.",nothing,"the segment exhibits the fallacy of appeal to tradition. this fallacy is committed when an argument is presented that something should be deemed valid or significant due to it being traditionally done in such a manner, without considering if there are more rational reasons supporting the claim. in this specific case, the speaker rejects the idea of a global environmental task force on the basis of its perceived lack of clarity and purpose, rather than assessing its potential advantages or efficiency.",False
682,Humans are to blame for some animal extinctions.,nothing,"the segment contains the fallacy of oversimplification. this fallacy occurs when a complex or multifaceted issue is reduced to a single, overly simplified explanation or assumption, in this case, that all humans are inherently selfish.",False
683,Yes. It will allow the mothers to go to school and help the children to grow up better.,nothing,"the segment exhibits the fallacy of appeal to consequentialism. this fallacy occurs when an argument is made based on the assumption that a specific outcome or consequence will necessarily result from a particular action or event. in this case, the statement implies that allowing mothers to go to school will automatically lead to their children growing up better. however, this assumption does not take into account other factors and variables that could influence the children's growth and development.",False
684,"Economic experts say that further austerity measures will not be beneficial, so we should help Greece with new investment to keep it in the Eurozone.",nothing,"the segment contains the fallacy of appeal to authority. this fallacy occurs when an argument is deemed valid or correct solely because it has been endorsed by an authority figure or expert, regardless of the actual merit of the argument itself. in this case, the statement's credibility relies on the opinions of economic experts without considering alternative perspectives or evidence.",False
685,"In modern jobs, home office is already the standard, because the workers are more productive at home. Why shouldn't this be better for kids as well?",nothing,"the provided argument is an example of the analogy fallacy. it assumes that because remote work is productive for adults, the same would apply to children in a home office setting, without considering the differences between adult and child workers, their tasks, and their developmental needs.",False
686,Neuer is the best goalkeeper of the World Cup by far as he let very few balls slip by.,nothing,"the segment demonstrates the fallacy of hasty generalization. this fallacy arises when a conclusion is drawn from a limited data set or single event. in this instance, the assertion that neuer is ""by far"" the best goalkeeper relies on one aspect (few balls slipped by) without considering other important factors such as saves, performances against different teams, and overall tournament performance.",False
687,Kids need to go to a proper school and home schooling harms them.,nothing,"the provided segment seems to exhibit the fallacy of hasty generalization. this type of logical error occurs when a conclusion is drawn from an insufficient sample size or without sufficient evidence. in this instance, the statement makes a sweeping claim about all home schooling and its detrimental effects on children, without taking into account individual experiences or presenting any concrete data to support the assertion.",False
688,Decreasing the price will increase the demand.,nothing,"the argument ""decreasing the price will increase the demand"" exhibits the fallacy of false cause, also known as post hoc ergo propter hoc. this fallacy is characterized by assuming that because one event (decreased price) follows another event (increased demand), it must be the cause of the second event. however, there could be other factors influencing the demand besides the price.",False
689,Athletes definitely should be drug tested!,nothing,the given segment does not provide enough information or context to identify a specific fallacy. please provide more details or context for a proper analysis.,False
690,The EU would be better adapting so that Greece is able to function well while staying in the country.,nothing,"the segment demonstrates the fallacy of appeal to consequentialism. this fallacy occurs when a decision is made solely based on the potential outcomes or consequences, without considering other relevant factors or alternative options. in this case, the argument suggests that greece should adapt for the eu's benefit, but it does not consider greece's perspective or needs in the process.",False
691,But every country that agreed to be in the EU agreed to an obligation to support other EU countries.,nothing,"rephrased question:
in the given text, which type of logical error can be observed based on the provided list of possible fallacies and their explanations? please specify the exact fallacy present in the text.

text: but every country that agreed to be in the eu agreed to an obligation to support other eu countries.

response template:
the text exhibits the fallacy of [fallacy name]. this fallacy occurs when [brief description of the identified fallacy].",False
692,"If marijuana is provided by the pharmacies or health centers to the individuals with prescriptions for health purposes in a controlled way, that should be allowed.",nothing,"in the given statement, the fallacy of appeal to tradition can be identified. this fallacy occurs when an argument is made that something should be considered correct or valid simply because it has been done in the past or follows traditional practices, without considering whether those practices are actually reasonable or logical in the current context.",False
