,text,expected_label,actual_label,result
213,Why are people so concerned about rising college tuition costs when there are children in developing countries who can't even go to school? ,appeal to worse problems,"the segment demonstrates the presence of the false dilemma fallacy. this type of logical fallacy is characterized by presenting only two options as if they are the only possibilities, while in reality there may be other valid alternatives or considerations. in this case, the speaker implies that either people should be concerned about rising college tuition costs or children in developing countries who can't go to school. however, it's possible to be concerned about both issues simultaneously.",False
214,"Yes, there are issues with police misconduct in our country, but in some nations, the police are outright oppressive and engage in widespread human rights abuses. Our situation isn't nearly as bad.",appeal to worse problems,"the segment displays the fallacy of false dilemma. this fallacy arises when two options are presented as the only possibilities when there are other valid alternatives or perspectives to consider. in this case, the argument suggests that either there is no police misconduct in our country or it is a minor issue compared to more oppressive nations, disregarding the possibility of significant but less extreme police misconduct within our own country.",False
215,"People complain about food deserts in urban areas, but there are places in the world where famine is a constant threat and people are starving.",appeal to worse problems,"the statement demonstrates a commitment to the fallacy of false analogy. this fallacy occurs when two situations are compared incorrectly, making an unfair or misleading comparison that leads to an illogical conclusion. in this case, the argument implies that because people in some parts of the world face famine and starvation, those who complain about food deserts in urban areas should not be concerned. however, these two issues are not directly comparable, as they deal with different aspects of food availability and accessibility.",False
216,Why focus on the plastic waste problem here when there are countries dumping massive amounts of garbage directly into the ocean? ,appeal to worse problems,"the provided argument segment employs the fallacy of false dilemma. this is because it presents the plastic waste problem and ocean dumping as mutually exclusive issues, when in fact they can be considered together and addressed concurrently. it's a fallacy because it limits the focus to only these two options and disregards other potential causes or solutions for environmental problems.",False
217,"Sure, there are debates about gender equality in the workplace, but in some countries, women aren't even allowed to work or drive.",appeal to worse problems,"the segment contains the fallacy of appeal to tradition. this fallacy occurs when an argument is made that something is better because it is traditional, rather than providing evidence for its superiority based on more objective criteria. in this case, the appeal to tradition suggests that the restriction of women's rights in some countries is justified simply because it has been a longstanding custom, without considering whether these customs are fair or beneficial.",False
218,"People complain about the healthcare system here, but at least we have hospitals and doctors. In some places, there are no medical facilities at all.",appeal to worse problems,"the provided segment demonstrates the fallacy of false dilemma. this type of logical fallacy occurs when a situation is presented with only two options, when in reality there may be more possibilities. in this case, the argument suggests that people should appreciate the healthcare system because it is better than having no medical facilities at all. however, this oversimplification neglects to consider other potential scenarios or the possibility of improving the current system.",False
219,"You're concerned about mental health stigma in our society? In some cultures, mental illness is not even recognized and people receive no help at all.",appeal to worse problems,"the segment demonstrates a [false dichotomy] fallacy. this fallacy emerges when two options are presented as the sole possibilities, suggesting that they are mutually exclusive when other alternatives may exist. in this case, the segment implies either mental health stigma exists or people receive no help at all, neglecting the possibility of varying levels of awareness and support for mental illness within different cultures.",False
220,Stop being unhappy! There are people who have it worse than you!,appeal to worse problems,"the provided segment exemplifies the fallacy known as appeal to worse problems. this fallacy occurs when an individual tries to discredit or dismiss a problem by comparing it to other, larger issues that may not be directly relevant to the original issue at hand. in this context, the speaker aims to diminish the listener's unhappiness by pointing out that there are people with more significant problems in the world. this approach does not necessarily address the legitimacy of the listener's feelings of unhappiness but seeks to undermine their emotions by highlighting comparatively greater difficulties faced by others.",False
221,Stop being unhappy! There are people who do not have it as good as you!,appeal to worse problems,"the segment demonstrates the fallacy of appeal to pity. this fallacy is present when an argument seeks to persuade by evoking emotions of pity or compassion, rather than providing a rational and logical basis for its claims. in this specific case, the statement intends to make the reader feel guilty about their unhappiness by contrasting it with individuals who have it even worse, rather than focusing on identifying the underlying causes of unhappiness or presenting practical solutions to alleviate it.",False
222,Stalin wasn't as bad as Hitler.,appeal to worse problems,"the segment contains the fallacy of false dilemma. this fallacy occurs when two options are presented as the only possibilities, ignoring other potential alternatives or nuances in the situation. in this case, the statement implies that one can only choose between stalin and hitler, disregarding the complexities and differences in their actions and impact on history.",False
223,"Barack Obama might be detaining people without trial and bombing civilians in other countries, but Bush did far worse.",appeal to worse problems,"the provided segment demonstrates a case of the fallacy of relative privation. this fallacy arises when a statement is defended by claiming that another party's actions are worse, implying that the initial action is justified or excusable due to the other party's misdeeds.",False
224,"Yes, the US is keeping secret prisons, but we're not as bad as Saddam Hussein!",appeal to worse problems,"the segment demonstrates the fallacy of false dichotomy. this fallacy occurs when an argument is presented as if there are only two options, when in reality there may be more alternatives or a continuum of possibilities. in this case, the speaker implies that either the us is keeping secret prisons and is therefore as bad as saddam hussein, or the us is not keeping secret prisons. however, there could be other scenarios or degrees of wrongdoing between these two extremes.",False
225,"Women are stereotyped by the media, but it isn't as big of a problem as poverty, wars, or human rights in the world!",appeal to worse problems,"rephrased question:
in the given segment, which type of logical error or fallacy is present, based on the list provided?

segment: women are stereotyped by the media, but it isn't as big of a problem as poverty, wars, or human rights in the world!

response template:
the given segment contains an example of the ad hominem fallacy. this fallacy involves attacking the person making the argument instead of addressing the actual content of the argument. in this case, the discussion shifts from media stereotyping to unrelated global issues.",False
226,"gun ownership shouldn't be restricted, because people driving cars cause more deaths than people using guns and we're not restricted from owning cars.",appeal to worse problemss,"the given segment demonstrates a fallacy known as false analogy. this logical error occurs when two situations are compared but share insufficient similarities for the comparison to be valid. in this case, the argument compares gun ownership and car ownership without considering essential differences between the two. cars serve a broader purpose in society and are required for transportation needs. on the other hand, guns are primarily used for self-defense and have the potential to cause significant harm if misused. the comparison between these two situations does not provide a valid justification for maintaining unrestricted gun ownership.",False
227,"Smoking may be a bad thing, but it's not as bad as car exhausts.",appeal to worse problems,"the provided segment demonstrates the use of the false dilemma fallacy. this logical error occurs when only two options are presented as if they are the sole possibilities, while there may be additional alternatives or aspects to consider. in this case, the statement suggests that smoking is either not detrimental or less harmful than car exhausts, without taking into account other potential negative consequences of smoking.",False
228,"Sure, US forces tortured people in Afghanistan, but it's not as bad as what the Japanese did in WWII.",appeal to worse problems,"the statement presents an instance of appeal to worse problems, a common type of logical error that arises when an argument is constructed on the basis of a specific flaw. this fallacy is known for its tendency to manipulate or distort information, often by using inappropriate comparisons or drawing invalid conclusions from insufficient data.

in this case, the fallacy is appeal to worse problems. this type of logical error occurs when an argument dismisses a problem or issue because there are perceived greater issues at hand, often resulting in a false comparison between two distinct matters that may not be directly related. by using the horrific acts committed by the japanese during world war ii as a point of reference for the actions of us forces in afghanistan, the statement oversimplifies and trivializes the seriousness of both situations. the argument implicitly suggests that the atrocities of one group somehow justify or diminish the actions of another, which is a misguided comparison that fails to accurately consider the unique circumstances of each situation.",False
229,Sexism and misogyny is not a problem in the Western World. Just look to the Middle East.,appeal to worse problems,"in the context of the provided argument, which fallacy is present in the following segment discussing sexism and misogyny in the western world and the middle east?

segment: sexism and misogyny is not a problem in the western world. just look to the middle east.

response template:
the segment exhibits the fallacy of false dichotomy. this fallacy occurs when an argument presents only two options, implying that if one is true, the other must be false, without considering alternative possibilities. in this case, the statement implies that either sexism and misogyny are a problem in the western world or they are not a problem at all in the middle east. this oversimplification ignores the possibility that both regions may have different forms and degrees of sexism and misogyny, or that other factors might be involved.",False
230,Be happy with the 1972 Chevy Nova you drive.  There are many people in this country who don’t even have a car.,appeal to worse problems,"the argument exhibits the ad populum fallacy, which is committed when an argument's validity is based on the belief or support of many people without providing substantial evidence or logical reasoning. in this instance, the speaker argues for contentment with a 1972 chevy nova by asserting that there are individuals who do not even possess a car, suggesting that having such a vehicle should be adequate due to its relative rarity.",False
231,"Yes, people talk less because they are too wrapped up in watching TV.",causal oversimplification,the provided text does not contain any specific example or information to analyze. please provide a segment of text or context for me to identify the relevant fallacy from the list given.,False
232,"Earlier this month, NASA scientists provided a visualization of a startling climate change trend — the Earth is getting greener, as viewed from space, especially in its rapidly warming northern regions. And this is presumably occurring as more carbon dioxide in the air, along with warmer temperatures and longer growing seasons, makes plants very, very happy.",causal oversimplification,"in the given segment, the author utilizes the fallacy of causal oversimplification. this type of fallacy occurs when a single cause is assigned to an outcome that has multiple causes. the statement ""more carbon dioxide in the air, along with warmer temperatures and longer growing seasons, makes plants very, very happy"" oversimplifies the relationship between carbon dioxide levels and plant growth by implying that increased carbon dioxide alone is responsible for the observed effects, while neglecting the influence of other factors such as temperature and growing seasons.",False
233,A sedentary lifestyle contributes to obesity. People have become more sedentary in the last few decades. The rise in obesity can be fixed by people getting more exercise.,causal oversimplification,"the segment exhibits a fallacy known as hasty generalization. this type of fallacy is committed when a conclusion is drawn from an insufficient or limited sample size or data, which may not necessarily be representative of the entire population. in this case, the statement implies that the increase in sedentary lifestyle is the sole cause for the rise in obesity. however, there could be other factors at play such as changes in diet or individual genetic predispositions.",False
234,Smoking has been empirically proven to cause lung cancer. If we eradicate smoking we will eradicate lung cancer.,causal oversimplification,"the argument presents the fallacy of causal oversimplification. this error occurs when a specific cause is linked to an outcome without considering other contributing factors. in this case, although smoking is a major cause of lung cancer, it does not account for every instance of the disease. factors like genetics and environmental exposure can also play roles in the development of lung cancer.",False
235,You see; it's simple. Crime rates are skyrocketing because of all these immigrants flooding in. They bring their problems with them and it's causing chaos.,causal oversimplification,"the segment contains the fallacy of hasty generalization. this fallacy occurs when a conclusion is drawn from insufficient evidence, or when a broad claim is made based on a limited number of instances. in this case, the argument implies that all immigrants are responsible for the increase in crime rates and chaos, without considering other factors or providing concrete evidence to support this claim.",False
236,Automation is the real culprit behind unemployment. Why hire people when you can have machines do the work cheaper and faster? That's why so many folks are out of a job.,causal oversimplification,"the segment demonstrates the fallacy of causal oversimplification. this logical error occurs when a complex issue is attributed to a single cause, disregarding other potential factors at play. in this case, the statement implies that automation is solely responsible for unemployment, without considering other contributing elements such as economic changes, fluctuations in the job market, and advancements in various industries that could also impact employment levels.",False
237,I'm telling you - smartphones are ruining our kids' education. They're constantly glued to those screens and it's no wonder their grades are dropping like flies.,causal oversimplification,"the provided segment seems to present a fallacy known as hasty generalization. this type of logical error occurs when one makes a conclusion based on a limited sample size or evidence that may not be representative of the broader population. in this instance, the speaker attributes the decline in kids' education to smartphones without considering other potential factors or examining more comprehensive data.",False
238,Have you seen the games kids play these days? It's all violence violence violence. No wonder they're becoming more aggressive. Blame it on those video games.,causal oversimplification,"in the provided segment discussing the impact of video games on children's behavior, which fallacy is exhibited?

segment: ""have you seen the games kids play these days? it's all violence violence violence. no wonder they're becoming more aggressive. blame it on those video games.""

response template:
the given segment illustrates the fallacy of hasty generalization. this fallacy arises when a conclusion is drawn based on limited or insufficient evidence, resulting in oversimplified and potentially inaccurate generalizations. in this instance, the argument implies that all video games are violent and holds them solely responsible for children's increasing aggression, despite not considering other factors or providing adequate evidence.",False
239,Our society is going down the drain because we're losing touch with our values. Everything's so different now and it's causing all sorts of problems.,causal oversimplification,"in the given segment, which type of logical error or fallacy can be identified based on its content and the list of potential fallacies?

segment: our society is deteriorating because we're losing touch with our values. everything has changed so much now, and it's causing numerous issues.

response template:
the segment exemplifies the fallacy of appeal to tradition. this fallacy emerges when an argument claims that something is superior or more valid solely due to its long-standing practice, without considering whether there are other equally viable alternatives or if the tradition itself has become obsolete.",False
240,Look at the government spending money left and right like there's no tomorrow. Of course the economy's in the gutter. It's overspending 101.,causal oversimplification,"the segment exhibits the fallacy of false cause. this fallacy occurs when a conclusion is drawn based on the assumption that one event must be the cause of another, without sufficient evidence or logical reasoning. in this case, the assumption is made that government spending causes the economy to suffer, but there is no direct causal relationship established between the two.",False
241,It's obvious isn't it? More divorces happen because men and women don't know their roles anymore. Once upon a time things were simpler and families stayed together.,causal oversimplification,"the argument in question demonstrates the fallacy of hasty generalization. this fallacy is characterized by making a conclusion based on insufficient or anecdotal evidence, often leading to an overly broad statement that doesn't account for all possible variables or exceptions. in this case, the claim that more divorces happen because men and women don't know their roles anymore is a generalization that doesn't consider other factors that could contribute to divorce rates, such as individual personalities, social changes, and economic conditions.",False
242,Globalization is killing off our industries. We used to be self-sufficient but now everything's made overseas. No wonder people are losing their jobs left and right.,causal oversimplification,"the segment displays an instance of the hasty generalization fallacy. this type of logical error occurs when a conclusion is made based on limited evidence or a small sample size, disregarding other relevant factors that could influence the outcome. in this case, the statement implies that globalization is solely responsible for the decline of domestic industries and job losses without considering additional influencing factors such as technological advancements, changes in market demands, or shifts in consumer preferences.",False
243,Social media is messing with our heads. All these likes and follows are making us anxious and depressed. It's the price we pay for being so connected.,causal oversimplification,"the segment contains the fallacy of appeal to nature. this fallacy occurs when an argument is made that something is good because it is 'natural' or bad because it is 'unnatural'. in this case, the statement suggests that social media, which is a product of human society and technology, is inherently harmful due to its unnatural nature, rather than examining its specific effects on mental health.",False
244,Distracted driving is the scourge of our roads. People can't put down their phones for a second and it's causing accidents left and right. Ban those devices I say.,causal oversimplification,"in the provided argument segment, the fallacy of hasty generalization is present. this fallacy arises when a conclusion is drawn based on a small sample size or insufficient evidence. the argument makes a broad claim about distracted driving causing accidents left and right without providing specific examples or data to support such a generalized statement.",False
245,You see what happens when we lose our faith? Moral decay sets in. We need to get back to our roots and restore some order.,causal oversimplification,"the segment presents the fallacy of appeal to tradition. this fallacy occurs when an argument is made that something is better or more valid simply because it is traditional or has been done that way for a long time, without considering the actual merits or evidence supporting the practice. in this case, the speaker assumes that returning to ""our roots"" will automatically lead to moral order and restoration, despite not providing any logical reasoning or substantive evidence for this claim.",False
246,Fast food is the devil's work. Kids these days are hooked on burgers and fries and that's why we're seeing so many chubby youngsters.,causal oversimplification,"in the context of the given argument and the list of potential fallacies, the fallacy observed in the provided statement is the hasty generalization. this fallacy is demonstrated within the statement when it generalizes the eating habits of ""kids these days"" to all children and attributes the increase in chubby youngsters solely to their consumption of fast food, based on a potentially small sample size or limited evidence.",False
247,Thank goodness for law enforcement cracking down. Crime rates are dropping because the cops are finally doing their job and putting criminals behind bars.,causal oversimplification,"the provided statement demonstrates the fallacy of hasty generalization. this fallacy takes place when a conclusion is made based on limited information or a small sample size, without considering the complete context or alternative explanations. in this instance, the statement attributes the decrease in crime rates solely to law enforcement's increased efforts, disregarding other potential factors that may have contributed to the reduction in criminal activity.",False
248,All this sanitizing and cleaning is making us sick. Our immune systems are weak because we're not exposed to enough germs. Bring back the dirt I say.,causal oversimplification,"the segment demonstrates the fallacy of causal oversimplification. this occurs when a single cause is attributed to an outcome, while in reality there are multiple contributing factors at play. in this argument, the connection between exposure to germs and immune system strength is oversimplified, as other factors also influence our overall health.",False
249,Nobody reads anymore. Why bother when you can binge-watch the latest shows? It's no wonder literacy rates are plummeting.,causal oversimplification,"in the given segment, the fallacy present is hasty generalization. this error occurs when a sweeping conclusion is drawn from a small or limited sample size, without taking into account other factors that may affect the outcome. by stating ""nobody reads anymore"" and ""it's no wonder literacy rates are plummeting,"" the argument generalizes the reading habits of the entire population based on potentially insufficient data, which can result in a misleading understanding of the situation.",False
250,Media bias is out of control. You can't trust anything you read or watch these days. It's no wonder we're all at each other's throats.,causal oversimplification,"the segment exhibits the fallacy of hasty generalization, which occurs when a conclusion is drawn based on insufficient evidence or an oversimplification of the issue. in this case, the speaker makes a broad claim about media bias and its effects on society without providing adequate evidence or considering other possible factors that could be contributing to the problem.",False
251,Climate change is to blame for everything including wildfires. It's getting hotter and drier out there and it's a recipe for disaster.,causal oversimplification,"the segment exhibits the fallacy of overgeneralization. this fallacy occurs when a claim is made that applies to all members of a category without considering exceptions or variations within that category. in this case, the statement implies that climate change is entirely responsible for every instance of wildfires, which oversimplifies the complex relationship between climate change and wildfire occurrences.",False
